[
  {
    "date": "2026-01-27T06:09:01.364Z",
    "address": "AX-ICICIT-S",
    "type": "1",
    "body": "We have applied Usage Settings on ICICI Bank Credit Card XX2003. Log in to iMobile Pay/Net Banking > View/Manage Card Usage. For details call 1800 1080."
  },
  {
    "date": "2026-01-26T14:52:25.069Z",
    "address": "CP-Pluxee-S",
    "type": "1",
    "body": "Rs. 674.00 spent from Pluxee  Meal Card wallet, card no.xx9013 on 26-01-2026 20:22:17 at SWIGGY . Avl bal Rs.833.44. Not you call 18002106919"
  },
  {
    "date": "2026-01-26T14:13:10.883Z",
    "address": "AX-ICICIT-S",
    "type": "1",
    "body": "ICICI Bank Credit Card XX7003 debited for INR 249.00 on 26-Jan-26 for UPI-687930953592-URBAN. To dispute call 18001080/SMS BLOCK 7003 to 9215676766"
  },
  {
    "date": "2026-01-26T13:38:20.042Z",
    "address": "AX-ICICIT-S",
    "type": "1",
    "body": "We have applied Usage Settings on ICICI Bank Credit Card XX2003. Log in to iMobile Pay/Net Banking > View/Manage Card Usage. For details call 1800 1080."
  },
  {
    "date": "2026-01-26T13:26:13.031Z",
    "address": "JM-ICICIT-S",
    "type": "1",
    "body": "USD 10.00 spent using ICICI Bank Card XX2003 on 26-Jan-26 on GITHUB, INC.. Avl Limit: INR 15,719.15. If not you, call 1800 2662/SMS BLOCK 2003 to 9215676766."
  },
  {
    "date": "2026-01-26T11:12:20.522Z",
    "address": "AX-LIVOTP-S",
    "type": "1",
    "body": "Sony LIV OTP is 4214, Use this to verify your mobile. -Sony LIV"
  },
  {
    "date": "2026-01-26T06:09:47.106Z",
    "address": "VM-axioLN-S",
    "type": "1",
    "body": "Update Ashish, We have received your timely repayment towards your Pay Later XXX6185 a/c .You can now check your updated personal loan eligibility here https://u.axio.ac/axo/dgWAMSqEYfjve -axio"
  },
  {
    "date": "2026-01-26T04:31:41.960Z",
    "address": "CP-IndiGo-S",
    "type": "1",
    "body": "Dear IndiGo Customer, we are eager to know about your recent interaction experience with us. Click  https://smler.in/IndiGo/qwjyJLA3MB to provide feedback."
  },
  {
    "date": "2026-01-26T04:20:02.902Z",
    "address": "CP-BLUDRT-S",
    "type": "1",
    "body": "Your order with Blue Dart AWB# 76801084990 was delivered to SELF . Please Rate our Service on https://acl.cc/BLUDRT/xEqgaKXN"
  },
  {
    "date": "2026-01-26T04:10:09.417Z",
    "address": "JM-BLUDRT-S",
    "type": "1",
    "body": "Your Blue Dart Secure Delivery Code is 433423 and its valid for next 30 minutes. Enter this Delivery Code on the device to receive the package."
  },
  {
    "date": "2026-01-26T04:10:07.498Z",
    "address": "JM-BLUDRT-S",
    "type": "1",
    "body": "Your Blue Dart Secure Delivery Code is 433423 and its valid for next 30 minutes. Enter this Delivery Code on the device to receive the package."
  },
  {
    "date": "2026-01-26T04:10:00.972Z",
    "address": "JM-BLUDRT-S",
    "type": "1",
    "body": "Your Blue Dart Secure Delivery Code is 433423 and its valid for next 30 minutes. Enter this Delivery Code on the device to receive the package."
  },
  {
    "date": "2026-01-26T04:02:14.393Z",
    "address": "AX-ICICIT-S",
    "type": "1",
    "body": "INR 629.00 spent using ICICI Bank Card XX2003 on 26-Jan-26 on AMAZON PAY IN G. Avl Limit: INR 16,639.10. If not you, call 1800 2662/SMS BLOCK 2003 to 9215676766."
  },
  {
    "date": "2026-01-26T02:51:31.539Z",
    "address": "CP-BLUDRT-S",
    "type": "1",
    "body": "ARRIVING: Blue Dart will deliver your shipment TODAY.Track https://acl.cc/BLUDRT/9yExZeeX .Be cautious of spam from unknown numbers. Avoid sharing information or clicking links, except from confirmed Blue Dart official numbers."
  },
  {
    "date": "2026-01-25T15:01:44.141Z",
    "address": "JX-ICICIT-S",
    "type": "1",
    "body": "ICICI Bank Credit Card XX7003 debited for INR 60.00 on 25-Jan-26 for UPI-639104253305-VIJAYAMM. To dispute call 18001080/SMS BLOCK 7003 to 9215676766"
  },
  {
    "date": "2026-01-25T14:54:33.052Z",
    "address": "JD-ICICIT-S",
    "type": "1",
    "body": "ICICI Bank Credit Card XX7003 debited for INR 100.00 on 25-Jan-26 for UPI-639116254821-CAFE MUM. To dispute call 18001080/SMS BLOCK 7003 to 9215676766"
  },
  {
    "date": "2026-01-25T14:49:34.880Z",
    "address": "JD-ICICIT-S",
    "type": "1",
    "body": "ICICI Bank Credit Card XX7003 debited for INR 30.00 on 25-Jan-26 for UPI-639128244097-GANDLA. To dispute call 18001080/SMS BLOCK 7003 to 9215676766"
  },
  {
    "date": "2026-01-25T14:22:23.025Z",
    "address": "AD-ICICIT-S",
    "type": "1",
    "body": "ICICI Bank Credit Card XX7003 debited for INR 30.00 on 25-Jan-26 for UPI-639101241995-DINESH. To dispute call 18001080/SMS BLOCK 7003 to 9215676766"
  },
  {
    "date": "2026-01-25T13:55:01.581Z",
    "address": "+918065909349",
    "type": "1",
    "body": "Hi! You missed a call from +918065909349.Last call:25-01-2026 19:24:53."
  },
  {
    "date": "2026-01-25T13:54:57.497Z",
    "address": "AA-AIRVMS-S",
    "type": "1",
    "body": "Your voice mailbox is almost full. Please dial 52555 to delete some messages and keep receiving new voice message."
  },
  {
    "date": "2026-01-25T13:16:17.026Z",
    "address": "AD-ICICIT-S",
    "type": "1",
    "body": "INR 266.00 spent using ICICI Bank Card XX2003 on 25-Jan-26 on AMAZON PAY IN E. Avl Limit: INR 17,268.10. If not you, call 1800 2662/SMS BLOCK 2003 to 9215676766."
  },
  {
    "date": "2026-01-25T10:55:54.960Z",
    "address": "AD-ICICIT-S",
    "type": "1",
    "body": "ICICI Bank Credit Card XX2003 Statement is sent to tr**************33@yahoo.com. Total of Rs 30,569.23 or minimum of Rs 25,100.00 is due by 05-FEB-26."
  },
  {
    "date": "2026-01-24T15:58:17.649Z",
    "address": "JD-RBLCRD-S",
    "type": "1",
    "body": "INR9,139.00 spent at METRO BRANDS LIMITED on RBL Bank credit card (6089) on 24-01-2026.AVL limit- INR284,236.23. Not you? Call 02262327777 "
  },
  {
    "date": "2026-01-24T14:49:58.039Z",
    "address": "AD-ICICIT-S",
    "type": "1",
    "body": "INR 449.00 spent using ICICI Bank Card XX7003 on 24-Jan-26 on ZELEVEN HOSPITA. Avl Limit: INR 1,20,366.46. If not you, call 1800 2662/SMS BLOCK 7003 to 9215676766."
  },
  {
    "date": "2026-01-24T10:40:06.229Z",
    "address": "JX-NIMFND-S",
    "type": "1",
    "body": "Dear Investor, Our priority is to provide you best in class experience. Pls share your feedback by clicking http://nc3.in/NIMFND/ac8Ql1z Nippon India MF"
  },
  {
    "date": "2026-01-24T04:33:56.688Z",
    "address": "VM-axioFN-S",
    "type": "1",
    "body": "Update Ashish, We have received your timely repayment towards your Pay Later XXX6185 a/c .You can now check your updated personal loan eligibility here https://u.axio.ac/axo/dgWAMSqEYfjve -axio"
  },
  {
    "date": "2026-01-24T04:13:35.994Z",
    "address": "AD-ICICIT-S",
    "type": "1",
    "body": "ICICI Bank Credit Card XX7003 debited for INR 45.00 on 24-Jan-26 for UPI-639012976782-M/S.CN. To dispute call 18001080/SMS BLOCK 7003 to 9215676766"
  },
  {
    "date": "2026-01-24T02:37:23.227Z",
    "address": "AD-ICICIT-S",
    "type": "1",
    "body": "ICICI Bank Credit Card XX7003 debited for INR 194.00 on 24-Jan-26 for UPI-639025969465-UrbanCla. To dispute call 18001080/SMS BLOCK 7003 to 9215676766"
  },
  {
    "date": "2026-01-23T15:01:44.144Z",
    "address": "CP-POLBAZ-S",
    "type": "1",
    "body": "Ashish Tripathi payment of Rs.1748 for your TATA AIA Life policy no. C266121914 has been successfully debited on Jan 23, 2026. Team Policybazaar"
  },
  {
    "date": "2026-01-23T12:51:31.718Z",
    "address": "AA-AIRVMS-S",
    "type": "1",
    "body": "Your voice mailbox is almost full. Please dial 52555 to delete some messages and keep receiving new voice message."
  },
  {
    "date": "2026-01-23T06:22:18.359Z",
    "address": "AD-ICICIT-S",
    "type": "1",
    "body": "ICICI Bank Credit Card XX7003 debited for INR 528.79 on 23-Jan-26 for UPI-638919842572-CREDPAYA. To dispute call 18001080/SMS BLOCK 7003 to 9215676766"
  },
  {
    "date": "2026-01-23T01:52:24.930Z",
    "address": "AD-RBLCRD-S",
    "type": "1",
    "body": "Hi! Check your summary, payment details, download statements along with 20 plus services and 400 plus queries. Chat with RBLCares: https://re.cx/RBLCRD/RKBPL9JJWps - RBL Bank"
  },
  {
    "date": "2026-01-22T13:15:11.865Z",
    "address": "AE-AIRINF",
    "type": "1",
    "body": "Hi, we have processed Rs. 199.0 for your Airtel Mobile 8792875996. The payment will be updated within 15 minutes. Please keep your order ID 7420091584501772288 for future reference. Track your payment status via  https://i.airtel.in/Recharge-Bills"
  },
  {
    "date": "2026-01-22T11:42:27.682Z",
    "address": "AD-ICICIT-S",
    "type": "1",
    "body": "ICICI Bank Credit Card XX7003 debited for INR 130.00 on 22-Jan-26 for UPI-638828733645-ITPL PSQ. To dispute call 18001080/SMS BLOCK 7003 to 9215676766"
  },
  {
    "date": "2026-01-22T09:00:44.159Z",
    "address": "CP-POLBAZ-S",
    "type": "1",
    "body": "Ashish Tripathi payment of Rs.1748 for your TATA AIA Life policy no. C266121914 is due on 2026-01-23. The amount will be debited from your credit card/bank account. Please maintain sufficient balance. Team Policybazaar"
  },
  {
    "date": "2026-01-22T06:26:04.660Z",
    "address": "AD-AIRTEL-S",
    "type": "1",
    "body": "Never respond to emails/embedded links in messages/calls asking you to update or verify KYC documents/User ID/Password/Debit Card Number/PIN/CVV/OTP etc. Immediately change your passwords/CVV/PIN if you have accidentally revealed your credentials."
  },
  {
    "date": "2026-01-22T05:45:53.251Z",
    "address": "JM-FSTCRY-S",
    "type": "1",
    "body": "Please share 2104 OTP with our delivery partner while delivering your FirstCry package with tracking ID 1101307145363 via Rocketbees."
  },
  {
    "date": "2026-01-21T12:14:28.380Z",
    "address": "CP-SHPRKT-S",
    "type": "1",
    "body": "Order Picked: Your The Junket order 88827 has been picked up. Track @  https://shprkt.in/SHPRKT/b0okC1pMRMLl  Powered by Shiprocket"
  },
  {
    "date": "2026-01-21T12:05:01.381Z",
    "address": "+911600113006",
    "type": "1",
    "body": "Hi! You missed a call from +911600113006.Last call:21-01-2026 17:34:58."
  },
  {
    "date": "2026-01-21T12:05:00.043Z",
    "address": "AA-AIRVMS-S",
    "type": "1",
    "body": "Your voice mailbox is almost full. Please dial 52555 to delete some messages and keep receiving new voice message."
  },
  {
    "date": "2026-01-21T12:04:15.009Z",
    "address": "+911600113006",
    "type": "1",
    "body": "Hi! You missed a call from +911600113006.Last call:21-01-2026 17:34:08."
  },
  {
    "date": "2026-01-21T12:04:10.608Z",
    "address": "AA-AIRVMS-S",
    "type": "1",
    "body": "Your voice mailbox is almost full. Please dial 52555 to delete some messages and keep receiving new voice message."
  },
  {
    "date": "2026-01-21T09:23:53.296Z",
    "address": "JE-JIOVOC-S",
    "type": "1",
    "body": "Your JioFiber experience matters to us! Share your feedback and help us serve you better: www.jio.com/r/CLagbKuxD Thank you for choosing JioFiber!"
  },
  {
    "date": "2026-01-21T06:18:17.901Z",
    "address": "JM-IDFCFB-S",
    "type": "1",
    "body": "You've read and accepted secure usage guidelines on 21/01/2026 at 11:48.Not you? Call 1800 10 888. Team IDFC FIRST Bank"
  },
  {
    "date": "2026-01-21T02:29:37.189Z",
    "address": "VM-ICICIT-S",
    "type": "1",
    "body": "INR 1,101.00 spent using ICICI Bank Card XX2003 on 21-Jan-26 on AMAZON PAY IN G. Avl Limit: INR 17,534.10. If not you, call 1800 2662/SMS BLOCK 2003 to 9215676766."
  },
  {
    "date": "2026-01-20T12:25:48.720Z",
    "address": "+911600100025",
    "type": "1",
    "body": "Hi! You missed a call from +911600100025.Last call:20-01-2026 17:55:42."
  },
  {
    "date": "2026-01-20T12:25:43.734Z",
    "address": "AA-AIRVMS-S",
    "type": "1",
    "body": "Your voice mailbox is almost full. Please dial 52555 to delete some messages and keep receiving new voice message."
  },
  {
    "date": "2026-01-20T10:56:25.813Z",
    "address": "CP-POLBAZ-S",
    "type": "1",
    "body": "Ashish Tripathi payment of Rs.1748 for your TATA AIA Life policy no. C266121914 is due on 2026-01-23. The amount will be debited from your credit card/bank account. Please maintain sufficient balance. Team Policybazaar"
  },
  {
    "date": "2026-01-20T05:08:31.075Z",
    "address": "JM-Pluxee-S",
    "type": "1",
    "body": "Rs. 210.00 spent from Pluxee  Meal Card wallet, card no.xx9013 on 20-01-2026 10:38:22 at SWIGGY . Avl bal Rs.1507.44. Not you call 18002106919"
  },
  {
    "date": "2026-01-20T04:16:14.885Z",
    "address": "AD-FSTCRY-S",
    "type": "1",
    "body": "Please share 9446 OTP with our delivery partner while delivering your FirstCry package with tracking ID 1101306900129 via Rocketbees."
  },
  {
    "date": "2026-01-20T03:53:39.654Z",
    "address": "JK-MLKBKT-S",
    "type": "1",
    "body": "Your OTP for Milkbasket login is 1170. This OTP will expire at 20/01/2026 09:26:35 AM. Happy Milkbasketing! tG3K6W/hoYk Milkbasket"
  },
  {
    "date": "2026-01-19T16:10:30.375Z",
    "address": "+918144863228",
    "type": "1",
    "body": "Airtel Warning: SPAM | [Traffic Management] Your vehicle committed a traffic infraction on Jan 10, 2026. Please view https://echallzec.co/in and drive safely at all times."
  },
  {
    "date": "2026-01-19T13:38:12.193Z",
    "address": "AE-AIRINF",
    "type": "1",
    "body": "Hi, Payment of Rs. 120.0 has failed for your Airtel Mobile 8792875996. Any amount, if debited will be refunded to your source account within a day. Please keep order ID 7419010222815125504 for reference."
  },
  {
    "date": "2026-01-19T13:33:28.978Z",
    "address": "JM-ICICIT-S",
    "type": "1",
    "body": "ICICI Bank Credit Card XX7003 debited for INR 40.00 on 19-Jan-26 for UPI-745420179104-ASHA N. To dispute call 18001080/SMS BLOCK 7003 to 9215676766"
  },
  {
    "date": "2026-01-19T11:22:46.859Z",
    "address": "AD-PTNNPS-S",
    "type": "1",
    "body": "Investment value in Tier I (PRANXX5796) as on 31.12.25 is Rs 3,61,932.69.To know more about MSF click https://vil.ltd/PTNNPS/c/QD26 -Protean"
  },
  {
    "date": "2026-01-19T09:12:20.111Z",
    "address": "JD-Pluxee-S",
    "type": "1",
    "body": "Rs. 213.00 spent from Pluxee  Meal Card wallet, card no.xx9013 on 19-01-2026 14:42:5 at SWIGGY . Avl bal Rs.1717.44. Not you call 18002106919"
  },
  {
    "date": "2026-01-19T04:03:09.626Z",
    "address": "VM-NEUPAS-S",
    "type": "1",
    "body": "Hi, 0.01 NeuCoin(s) used by you for transaction PO01626639308740 at Tata 1mg have been credited back to your account - Team Tata Neu"
  },
  {
    "date": "2026-01-18T10:09:52.068Z",
    "address": "AD-ICICIT-S",
    "type": "1",
    "body": "ICICI Bank Credit Card XX7003 debited for INR 100.00 on 18-Jan-26 for UPI-638408128629-Yarramre. To dispute call 18001080/SMS BLOCK 7003 to 9215676766"
  },
  {
    "date": "2026-01-18T09:58:24.092Z",
    "address": "JD-RBLCRD-S",
    "type": "1",
    "body": "INR2,247.00 spent at WLI*METRO BRANDS LIMIT on RBL Bank credit card (6089) on 18-01-2026.AVL limit- INR293,375.23. Not you? Call 02262327777 "
  },
  {
    "date": "2026-01-18T08:55:18.021Z",
    "address": "JD-RBLCRD-S",
    "type": "1",
    "body": "INR10,980.00 spent at THE LUGGAGE BOUTIQUE on RBL Bank credit card (6089) on 18-01-2026.AVL limit- INR295,622.23. Not you? Call 02262327777 "
  },
  {
    "date": "2026-01-18T08:40:21.606Z",
    "address": "JD-ICICIT-S",
    "type": "1",
    "body": "ICICI Bank Credit Card XX7003 debited for INR 170.00 on 18-Jan-26 for UPI-638429111929-AMADORAG. To dispute call 18001080/SMS BLOCK 7003 to 9215676766"
  },
  {
    "date": "2026-01-18T08:36:13.674Z",
    "address": "AD-ICICIT-S",
    "type": "1",
    "body": "ICICI Bank Credit Card XX7003 debited for INR 289.00 on 18-Jan-26 for UPI-638411124729-Lite Bit. To dispute call 18001080/SMS BLOCK 7003 to 9215676766"
  },
  {
    "date": "2026-01-18T04:32:20.913Z",
    "address": "JM-axioLN-S",
    "type": "1",
    "body": "Update Ashish, We have received your timely repayment towards your Pay Later XXX6185 a/c .You can now check your updated personal loan eligibility here https://u.axio.ac/axo/dgWAMSqEYfjve -axio"
  },
  {
    "date": "2026-01-18T04:21:05.436Z",
    "address": "JD-MLKBKT-S",
    "type": "1",
    "body": "Dear Customer, your Milkbasket top-up was successful! Your account has been credited with Rs. 2000.0 on 2026-01-18 09:50:59. New Balance: Rs 3952.77. Thank you!"
  },
  {
    "date": "2026-01-18T03:58:30.657Z",
    "address": "JK-FSTCRY-S",
    "type": "1",
    "body": "Please share 3440 OTP with our delivery partner while delivering your FirstCry package with tracking ID 1101207252868 via Rocketbees."
  },
  {
    "date": "2026-01-17T17:56:55.997Z",
    "address": "AD-ICICIT-S",
    "type": "1",
    "body": "INR 342.25 spent using ICICI Bank Card XX2003 on 17-Jan-26 on AMAZON PAY IN G. Avl Limit: INR 18,635.10. If not you, call 1800 2662/SMS BLOCK 2003 to 9215676766."
  },
  {
    "date": "2026-01-17T17:46:06.696Z",
    "address": "AD-ICICIT-S",
    "type": "1",
    "body": "ICICI Bank Credit Card XX7003 debited for INR 477.96 on 17-Jan-26 for UPI-638320052927-TATA 1MG. To dispute call 18001080/SMS BLOCK 7003 to 9215676766"
  },
  {
    "date": "2026-01-17T17:45:40.360Z",
    "address": "TX-MYTNEU-S",
    "type": "1",
    "body": "Hi, you've used 7.0 NeuCoin(s) at Tata 1mg on 17-01-2026. Check your NeuCoins balance at https://m.tneu.in/MYTNEU/LggAvoj - Team TataNeu"
  },
  {
    "date": "2026-01-17T16:18:02.354Z",
    "address": "JD-MLKBKT-S",
    "type": "1",
    "body": "Dear Customer, your Milkbasket top-up was successful! Your account has been credited with Rs. 2000.0 on 2026-01-17 21:47:58. New Balance: Rs 2202.47. Thank you!"
  },
  {
    "date": "2026-01-17T15:59:47.920Z",
    "address": "AD-ICICIT-S",
    "type": "1",
    "body": "ICICI Bank Credit Card XX7003 debited for INR 1,115.10 on 17-Jan-26 for UPI-638322047184-The Junk. To dispute call 18001080/SMS BLOCK 7003 to 9215676766"
  },
  {
    "date": "2026-01-17T15:51:49.164Z",
    "address": "VM-ICICIT-S",
    "type": "1",
    "body": "ICICI Bank Credit Card XX7003 debited for INR 1,663.52 on 17-Jan-26 for UPI-638308038068-FIRSTCRY. To dispute call 18001080/SMS BLOCK 7003 to 9215676766"
  },
  {
    "date": "2026-01-17T14:48:36.680Z",
    "address": "AD-ICICIT-S",
    "type": "1",
    "body": "ICICI Bank Credit Card XX7003 debited for INR 100.00 on 17-Jan-26 for UPI-638319018885-RAJA. To dispute call 18001080/SMS BLOCK 7003 to 9215676766"
  },
  {
    "date": "2026-01-17T12:51:59.777Z",
    "address": "JD-ICICIT-S",
    "type": "1",
    "body": "ICICI Bank Credit Card XX7003 debited for INR 442.67 on 17-Jan-26 for UPI-638311007823-J K Ente. To dispute call 18001080/SMS BLOCK 7003 to 9215676766"
  },
  {
    "date": "2026-01-17T10:00:18.094Z",
    "address": "AD-ACTGRP-S",
    "type": "1",
    "body": "Dear Patron, We have successfully picked the ONT device. Please contact 9121212121 to process your refund if applicable. Hope to serve you again soon. Team ACT"
  },
  {
    "date": "2026-01-17T09:40:37.338Z",
    "address": "JD-DLHVRY-S",
    "type": "1",
    "body": "To DELIVER AL from JSBWORLDWIDE FRANCHISE (AWB 30035010376283), share OTP 2051. Track@ https://www.delhivery.com -Delhivery"
  },
  {
    "date": "2026-01-17T06:56:05.617Z",
    "address": "JM-ACTGRP-S",
    "type": "1",
    "body": "Ticket SR10278694066656 has been closed. https://soa.actcorp.in/csat/pc?id=1-105GEYG0 .Send N to 9632711600 to Reopen"
  },
  {
    "date": "2026-01-17T05:58:36.243Z",
    "address": "AX-RSPUBN-S",
    "type": "1",
    "body": "Dear Call RUHI-8207278196 To Meeting Your enquiry Received on -RSPUBLICITY"
  },
  {
    "date": "2026-01-17T04:21:10.575Z",
    "address": "JD-ICICIT-S",
    "type": "1",
    "body": "ICICI Bank Credit Card XX7003 debited for INR 45.00 on 17-Jan-26 for UPI-638301912170-THE ARUN. To dispute call 18001080/SMS BLOCK 7003 to 9215676766"
  },
  {
    "date": "2026-01-16T15:47:05.024Z",
    "address": "JD-Pluxee-S",
    "type": "1",
    "body": "Rs. 263.00 spent from Pluxee  Meal Card wallet, card no.xx9013 on 16-01-2026 21:16:44 at SWIGGY . Avl bal Rs.1930.44. Not you call 18002106919"
  },
  {
    "date": "2026-01-16T11:03:47.783Z",
    "address": "JX-ICICIT-S",
    "type": "1",
    "body": "ICICI Bank Credit Card XX7003 debited for INR 30.00 on 16-Jan-26 for UPI-638204829410-ALTAF. To dispute call 18001080/SMS BLOCK 7003 to 9215676766"
  },
  {
    "date": "2026-01-16T10:20:34.913Z",
    "address": "+916361116880",
    "type": "1",
    "body": "Okay"
  },
  {
    "date": "2026-01-16T10:20:33.853Z",
    "address": "+916361116880",
    "type": "1",
    "body": "Hi! You missed a call from +916361116880.Last call:16-01-2026 15:50:24."
  },
  {
    "date": "2026-01-16T10:20:28.046Z",
    "address": "AA-AIRVMS-S",
    "type": "1",
    "body": "Your voice mailbox is almost full. Please dial 52555 to delete some messages and keep receiving new voice message."
  },
  {
    "date": "2026-01-16T10:20:27.016Z",
    "address": "+916361116880",
    "type": "2",
    "body": "I'll call you later."
  },
  {
    "date": "2026-01-16T08:28:51.109Z",
    "address": "JM-Pluxee-S",
    "type": "1",
    "body": "Rs. 16.54 spent from Pluxee  Meal Card wallet, card no.xx9013 on 16-01-2026 13:57:42 at DVS FOOD AN . Avl bal Rs.2193.44. Not you call 18002106919"
  },
  {
    "date": "2026-01-16T08:27:11.083Z",
    "address": "JD-Pluxee-S",
    "type": "1",
    "body": "Rs. 110.25 spent from Pluxee  Meal Card wallet, card no.xx9013 on 16-01-2026 13:56:18 at CORPORATE C . Avl bal Rs.2209.98. Not you call 18002106919"
  },
  {
    "date": "2026-01-16T07:21:28.081Z",
    "address": "+919811868993",
    "type": "1",
    "body": "Hi! You missed a call from +919811868993.Last call:16-01-2026 12:51:18."
  },
  {
    "date": "2026-01-16T07:21:23.291Z",
    "address": "AA-AIRVMS-S",
    "type": "1",
    "body": "Your voice mailbox is almost full. Please dial 52555 to delete some messages and keep receiving new voice message."
  },
  {
    "date": "2026-01-16T02:14:36.939Z",
    "address": "JK-ACTGRP-S",
    "type": "1",
    "body": "Your Service request SR10278694066656 is expected to be resolved by 19-Jan between 09:00 to 13:00. Track status via:https://fb7y.app.link/etrs. Team ACT"
  },
  {
    "date": "2026-01-15T15:38:04.000Z",
    "address": "AD-ACTGRP-S",
    "type": "1",
    "body": "Your ACT Fibernet Ticket no: SR10278694066656 has been registered. Our team will ensure fastest possible action"
  },
  {
    "date": "2026-01-15T13:41:03.156Z",
    "address": "JK-TAGINS-S",
    "type": "1",
    "body": "Dear Customer, We are awaiting your feedback about your policy purchase experience. Please click tlux.in/TAGINS/mvUGi to share. In case of any assistance, please feel free to call our Customer care. T&C Apply. Tata AIG General Insurance Company Limited."
  },
  {
    "date": "2026-01-15T13:22:05.758Z",
    "address": "JM-ICICIT-S",
    "type": "1",
    "body": "Rs.80 paid at ForumShantiniketanMall for KA53MM4849 on 15-01-2026 15:59:39 with ICICI Bank FASTag. Bal Rs.244. Call 18002100104 for dispute"
  },
  {
    "date": "2026-01-15T12:59:54.381Z",
    "address": "JM-CINPLS-S",
    "type": "1",
    "body": "Dear Patron, Thank you for visiting Cinepolis. Help us improve by sharing your feedback here https://lwcx.in/?n=NB-CmFhtva7 -Cinepolis India Pvt Ltd"
  },
  {
    "date": "2026-01-15T10:44:38.294Z",
    "address": "JD-RBLCRD-S",
    "type": "1",
    "body": "INR1,170.00 spent at CINEPOLIS NEXUS SHANTI on RBL Bank credit card (6089) on 15-01-2026.AVL limit- INR306,602.23. Not you? Call 02262327777 "
  },
  {
    "date": "2026-01-15T09:20:00.587Z",
    "address": "+912653541765",
    "type": "1",
    "body": "Hi! You missed a call from +912653541765.Last call:15-01-2026 14:49:52."
  },
  {
    "date": "2026-01-15T05:57:15.218Z",
    "address": "AX-ELEMEG-S",
    "type": "1",
    "body": "Dear Call SANA- 8100537571 For Meeting Your enquiry Received on Portal Thanks -4ELEMENTS"
  },
  {
    "date": "2026-01-15T04:43:03.358Z",
    "address": "57575701",
    "type": "1",
    "body": "Epic Games: Your verification code is 420689"
  },
  {
    "date": "2026-01-15T04:09:59.977Z",
    "address": "JX-CINPLS-S",
    "type": "1",
    "body": "Dear Member, You have earned 67 Points. Balance 67 points, expire 31st Dec this year. -Cinepolis India Pvt Ltd"
  },
  {
    "date": "2026-01-15T04:09:15.462Z",
    "address": "VM-BMSHOW-S",
    "type": "1",
    "body": "Dear Cinepolis Club Member, Congratulations! You have earned 67 points on 15-01-2026 at Cinepolis: Nexus Shantiniketan, Bengaluru for Rs. 1000.00 transaction through BookmyShow. Your current point balance is 67."
  },
  {
    "date": "2026-01-15T04:09:12.148Z",
    "address": "VD-RBLCRD-S",
    "type": "1",
    "body": "INR659.30 spent at BOOKMYSHOW on RBL Bank credit card (6089) on 15-01-2026.AVL limit- INR307,772.23. Not you? Call 02262327777 "
  },
  {
    "date": "2026-01-15T04:08:47.431Z",
    "address": "AD-RBLBNK-T",
    "type": "1",
    "body": "678415 is OTP for txn of INR 659.30 at BOOK MY SH on RBL Bank Credit Card 6089. Valid for one time use. DO NOT SHARE IT WITH ANYONE."
  },
  {
    "date": "2026-01-14T17:28:47.509Z",
    "address": "JD-ICICIT-S",
    "type": "1",
    "body": "ICICI Bank Credit Card XX7003 debited for INR 199.00 on 14-Jan-26 for UPI-638013611443-UrbanCla. To dispute call 18001080/SMS BLOCK 7003 to 9215676766"
  },
  {
    "date": "2026-01-14T13:38:09.144Z",
    "address": "JX-TAGINS-S",
    "type": "1",
    "body": "Hi Customer, your TATA AIG Motor Two Wheeler policy has been issued on 12-01-2026. The soft copy has been emailed to you. We'd love to hear about your purchase experience. Please click tlux.in/TAGINS/mtdEE to share your feedback. T&C apply -TATA AIG"
  },
  {
    "date": "2026-01-14T10:33:19.043Z",
    "address": "JD-DLHVRY-S",
    "type": "1",
    "body": "To DELIVER Sirf Mirchi from JSBWORLDWIDE FRANCHISE (AWB 30035010371803), share OTP 9901. Track@ https://www.delhivery.com -Delhivery"
  },
  {
    "date": "2026-01-14T06:58:41.877Z",
    "address": "+912069064542",
    "type": "1",
    "body": "Hi! You missed a call from +912069064542.Last call:14-01-2026 12:28:32."
  },
  {
    "date": "2026-01-14T06:58:35.303Z",
    "address": "AA-AIRVMS-S",
    "type": "1",
    "body": "Your voice mailbox is almost full. Please dial 52555 to delete some messages and keep receiving new voice message."
  },
  {
    "date": "2026-01-14T05:11:32.953Z",
    "address": "+912250801448",
    "type": "1",
    "body": "Hi! You missed a call from +912250801448.Last call:14-01-2026 10:41:29."
  },
  {
    "date": "2026-01-14T05:11:31.077Z",
    "address": "AA-AIRVMS-S",
    "type": "1",
    "body": "Your voice mailbox is almost full. Please dial 52555 to delete some messages and keep receiving new voice message."
  },
  {
    "date": "2026-01-14T04:56:23.740Z",
    "address": "VD-axioLN-S",
    "type": "1",
    "body": "Congrats Ashish, We have received your timely repayment towards your Pay Later XXX6185 a/c .You can now check your updated personal loan eligibility here https://u.axio.ac/axo/dgWAMSqEYfjve -axio"
  },
  {
    "date": "2026-01-14T04:35:02.020Z",
    "address": "JM-Pluxee-S",
    "type": "1",
    "body": "Rs. 612.00 spent from Pluxee  Meal Card wallet, card no.xx9013 on 14-01-2026 10:04:55 at SWIGGY INST . Avl bal Rs.2320.23. Not you call 18002106919"
  },
  {
    "date": "2026-01-13T17:04:14.453Z",
    "address": "CP-SWIGGY-S",
    "type": "1",
    "body": "Dear Swiggy customer, your refund reference number for Rs 210.0 is 251398419589-1-R1. https://r.swiggy.com/refunds"
  },
  {
    "date": "2026-01-13T16:53:53.950Z",
    "address": "JD-Pluxee-S",
    "type": "1",
    "body": "Your Pluxee Card xx9013 has been credited with INR 210.00 on Tue Jan 13 2026 22:23:45as a reversal against a previous transaction on Jan 13,2026 21:32:41."
  },
  {
    "date": "2026-01-13T16:53:48.730Z",
    "address": "AX-SWIGGY-S",
    "type": "1",
    "body": "Refund of Rs 210.0 has been initiated for Swiggy order 227289754136592. Updated balance should reflect in 4-7 days. https://r.swiggy.com/refunds"
  },
  {
    "date": "2026-01-13T16:53:47.548Z",
    "address": "AD-SWIGGY-S",
    "type": "1",
    "body": "We are unable to process your Swiggy order 227289754136592 as the restaurant is closed. We request you to place an order from another open restaurant, on our app."
  },
  {
    "date": "2026-01-13T16:53:43.818Z",
    "address": "AX-SWIGGY-S",
    "type": "1",
    "body": "Your Swiggy order #227289754136592 has been cancelled. We apologize for the inconvenience. For assistance with this order, please contact Swiggy support."
  },
  {
    "date": "2026-01-13T16:03:13.202Z",
    "address": "JD-TAGINS-S",
    "type": "1",
    "body": "Dear Customer, to download your MOTOR Policy Schedule  3749473504, please click here https://1im.io/TAGINS/pDsmqvZ .For assistance, visit www.tataaig.com.TATA AIG"
  },
  {
    "date": "2026-01-13T16:02:57.206Z",
    "address": "JD-Pluxee-S",
    "type": "1",
    "body": "Rs. 210.00 spent from Pluxee  Meal Card wallet, card no.xx9013 on 13-01-2026 21:32:41 at SWIGGY . Avl bal Rs.2722.23. Not you call 18002106919"
  },
  {
    "date": "2026-01-13T05:39:14.509Z",
    "address": "AX-ICICIT-S",
    "type": "1",
    "body": "Dear Customer, your transaction of Rs 54,510.75 using ICICI Bank Credit Card XX7003 has been converted into EMI on 12-01-26."
  },
  {
    "date": "2026-01-13T04:27:51.321Z",
    "address": "+912250801325",
    "type": "1",
    "body": "Hi! You missed a call from +912250801325.Last call:13-01-2026 09:57:46."
  },
  {
    "date": "2026-01-13T04:27:49.690Z",
    "address": "AA-AIRVMS-S",
    "type": "1",
    "body": "Your voice mailbox is almost full. Please dial 52555 to delete some messages and keep receiving new voice message."
  },
  {
    "date": "2026-01-13T04:24:02.589Z",
    "address": "JD-ICICIT-S",
    "type": "1",
    "body": "INR 824.00 spent using ICICI Bank Card XX2003 on 13-Jan-26 on AMAZON PAY IN E. Avl Limit: INR 18,977.35. If not you, call 1800 2662/SMS BLOCK 2003 to 9215676766."
  },
  {
    "date": "2026-01-13T04:23:43.949Z",
    "address": "AX-ICICIO-T",
    "type": "1",
    "body": "636957 is One-Time Password for INR 824.00 transaction towards AMAZON using ICICI Bank Credit Card XX2003. OTPs are SECRET. DO NOT disclose"
  },
  {
    "date": "2026-01-12T12:00:16.505Z",
    "address": "+919643201711",
    "type": "1",
    "body": "Hi! You missed a call from +919643201711.Last call:12-01-2026 17:30:07."
  },
  {
    "date": "2026-01-12T12:00:11.854Z",
    "address": "AA-AIRVMS-S",
    "type": "1",
    "body": "Your voice mailbox is almost full. Please dial 52555 to delete some messages and keep receiving new voice message."
  },
  {
    "date": "2026-01-12T10:22:58.971Z",
    "address": "+912069064466",
    "type": "1",
    "body": "Hi! You missed a call from +912069064466.Last call:12-01-2026 15:52:52."
  },
  {
    "date": "2026-01-12T10:22:54.354Z",
    "address": "AA-AIRVMS-S",
    "type": "1",
    "body": "Your voice mailbox is almost full. Please dial 52555 to delete some messages and keep receiving new voice message."
  },
  {
    "date": "2026-01-12T06:16:35.040Z",
    "address": "+912250801428",
    "type": "1",
    "body": "Hi! You missed a call from +912250801428.Last call:12-01-2026 11:46:24."
  },
  {
    "date": "2026-01-12T06:16:28.420Z",
    "address": "AA-AIRVMS-S",
    "type": "1",
    "body": "Your voice mailbox is almost full. Please dial 52555 to delete some messages and keep receiving new voice message."
  },
  {
    "date": "2026-01-12T03:08:51.123Z",
    "address": "AX-ICICIT-S",
    "type": "1",
    "body": "Reversal of Rs 35.00 credited to ICICI Bank Credit Card XX7003 on 12-JAN-26. Revised total due Rs 0, minimum due Rs .00"
  },
  {
    "date": "2026-01-11T16:06:41.763Z",
    "address": "AD-JIOHTR-S",
    "type": "1",
    "body": "Hi, your JioHotstar verification code is 8435"
  },
  {
    "date": "2026-01-11T15:16:35.311Z",
    "address": "+919415723615",
    "type": "1",
    "body": "Hi! You missed a call from +919415723615.Last call:11-01-2026 20:46:25."
  },
  {
    "date": "2026-01-11T15:16:27.771Z",
    "address": "AA-AIRVMS-S",
    "type": "1",
    "body": "Your voice mailbox is almost full. Please dial 52555 to delete some messages and keep receiving new voice message."
  },
  {
    "date": "2026-01-11T08:45:51.401Z",
    "address": "AX-ICICIT-S",
    "type": "1",
    "body": "ICICI Bank Credit Card XX7003 debited for INR 60.00 on 11-Jan-26 for UPI-637725064910-YASHIKA. To dispute call 18001080/SMS BLOCK 7003 to 9215676766"
  },
  {
    "date": "2026-01-11T07:45:35.455Z",
    "address": "JK-MLKBKT-S",
    "type": "1",
    "body": "Dear Customer, your Milkbasket top-up was successful! Your account has been credited with Rs. 2000.0 on 2026-01-11 13:15:32. New Balance: Rs 2492.56. Thank you!"
  },
  {
    "date": "2026-01-11T07:05:51.048Z",
    "address": "+912069064667",
    "type": "1",
    "body": "Hi! You missed a call from +912069064667.Last call:11-01-2026 12:35:44."
  },
  {
    "date": "2026-01-11T07:05:46.115Z",
    "address": "AA-AIRVMS-S",
    "type": "1",
    "body": "Your voice mailbox is almost full. Please dial 52555 to delete some messages and keep receiving new voice message."
  },
  {
    "date": "2026-01-11T05:09:02.609Z",
    "address": "VM-ICICIT-S",
    "type": "1",
    "body": "ICICI Bank Credit Card XX7003 debited for INR 3,500.00 on 11-Jan-26 for UPI-637715026310-J K Ente. To dispute call 18001080/SMS BLOCK 7003 to 9215676766"
  },
  {
    "date": "2026-01-11T05:04:54.350Z",
    "address": "AX-SHELGO-S",
    "type": "1",
    "body": "959644 is the OTP for Shell Go+. Valid for 15 minutes. f1obOaOBiPA"
  },
  {
    "date": "2026-01-11T04:23:37.387Z",
    "address": "AX-ICICIT-S",
    "type": "1",
    "body": "ICICI Bank Credit Card XX7003 debited for INR 45.00 on 11-Jan-26 for UPI-952245947622-THE ARUN. To dispute call 18001080/SMS BLOCK 7003 to 9215676766"
  },
  {
    "date": "2026-01-11T03:17:39.803Z",
    "address": "VA-ICICIT-S",
    "type": "1",
    "body": "ICICI Bank Credit Card XX7003 debited for INR 10.00 on 11-Jan-26 for UPI-960291228588-BharatPe. To dispute call 18001080/SMS BLOCK 7003 to 9215676766"
  },
  {
    "date": "2026-01-11T02:40:56.501Z",
    "address": "AX-ICICIO-T",
    "type": "1",
    "body": "023379 is One-Time Password for INR 254.00 transaction towards AMAZON using ICICI Bank Credit Card XX2003. OTPs are SECRET. DO NOT disclose"
  },
  {
    "date": "2026-01-10T17:54:03.190Z",
    "address": "JD-ICICIT-S",
    "type": "1",
    "body": "Rs 54,510.75 spent on ICICI Bank Card XX7003 on 10-Jan-26 at MAKEMYTRIP COM. Avl Lmt: Rs 1,33,501.53. To dispute, call 18002662/SMS BLOCK 7003 to 9215676766. To convert this txn to EMI give a missed call on 9924667667. Know more about EMI conversion at https://icici.co/ICICIT/j/8f6118ed"
  },
  {
    "date": "2026-01-10T17:53:26.365Z",
    "address": "AX-ICICIO-T",
    "type": "1",
    "body": "563380 is One-Time Password for INR 54510.75 transaction towards MAKEMYTRIP  using ICICI Bank Credit Card XX7003. OTPs are SECRET. DO NOT disclose"
  },
  {
    "date": "2026-01-10T17:42:12.273Z",
    "address": "JM-MMTRIP-S",
    "type": "1",
    "body": "254262 is the OTP to login into your MakeMyTrip account. Don't share your OTP/bank info with anyone. - MMT"
  },
  {
    "date": "2026-01-10T15:22:27.781Z",
    "address": "AX-ICICIT-S",
    "type": "1",
    "body": "ICICI Bank Credit Card XX7003 debited for INR 500.00 on 10-Jan-26 for UPI-578735763621-Milkbask. To dispute call 18001080/SMS BLOCK 7003 to 9215676766"
  },
  {
    "date": "2026-01-10T15:22:06.982Z",
    "address": "JD-MLKBKT-S",
    "type": "1",
    "body": "Dear Customer, your Milkbasket top-up was successful! Your account has been credited with Rs. 500.0 on 2026-01-10 20:52:05. New Balance: Rs 634.38. Thank you!"
  },
  {
    "date": "2026-01-10T15:21:36.262Z",
    "address": "VM-ICICIT-S",
    "type": "1",
    "body": "Transaction of INR 2,000.00 on ICICI Bank Credit Card XX7003 is declined due to incorrect CVV or card expiry date. Please retry with correct details."
  },
  {
    "date": "2026-01-10T15:20:36.351Z",
    "address": "AX-ICICIO-T",
    "type": "1",
    "body": "427294 is One-Time Password for INR 2000.00 transaction towards RELIANCE RE using ICICI Bank Credit Card XX7003. OTPs are SECRET. DO NOT disclose"
  },
  {
    "date": "2026-01-10T14:57:44.443Z",
    "address": "JK-HOMCEN-S",
    "type": "1",
    "body": "Dear Ashish, Hope you enjoyed your shopping at Home Centre! Click to view your e-invoice https://knvl.me/HOMCEN/jtLqocC"
  },
  {
    "date": "2026-01-10T14:57:22.003Z",
    "address": "JM-RBLCRD-S",
    "type": "1",
    "body": "INR1,073.40 spent at LIFE STYLE INTERNATION on RBL Bank credit card (6089) on 10-01-2026.AVL limit- INR308,431.53. Not you? Call 02262327777 "
  },
  {
    "date": "2026-01-10T11:03:23.897Z",
    "address": "AX-ICICIT-S",
    "type": "1",
    "body": "INR 214.00 spent using ICICI Bank Card XX2003 on 10-Jan-26 on AMAZON PAY IN E. Avl Limit: INR 20,055.35. If not you, call 1800 2662/SMS BLOCK 2003 to 9215676766."
  },
  {
    "date": "2026-01-10T11:02:34.635Z",
    "address": "AX-ICICIO-T",
    "type": "1",
    "body": "589604 is One-Time Password for INR 214.00 transaction towards AMAZON using ICICI Bank Credit Card XX2003. OTPs are SECRET. DO NOT disclose"
  },
  {
    "date": "2026-01-10T09:50:48.186Z",
    "address": "+918065909305",
    "type": "1",
    "body": "Hi! You missed a call from +918065909305.Last call:10-01-2026 15:20:44."
  },
  {
    "date": "2026-01-10T09:50:45.486Z",
    "address": "AA-AIRVMS-S",
    "type": "1",
    "body": "Your voice mailbox is almost full. Please dial 52555 to delete some messages and keep receiving new voice message."
  },
  {
    "date": "2026-01-10T09:23:27.460Z",
    "address": "+912069064679",
    "type": "1",
    "body": "Hi! You missed a call from +912069064679.Last call:10-01-2026 14:53:23."
  },
  {
    "date": "2026-01-10T09:23:23.852Z",
    "address": "AA-AIRVMS-S",
    "type": "1",
    "body": "Your voice mailbox is almost full. Please dial 52555 to delete some messages and keep receiving new voice message."
  },
  {
    "date": "2026-01-10T08:19:21.766Z",
    "address": "+912250801361",
    "type": "1",
    "body": "Hi! You missed a call from +912250801361.Last call:10-01-2026 13:49:17."
  },
  {
    "date": "2026-01-10T08:19:18.756Z",
    "address": "AA-AIRVMS-S",
    "type": "1",
    "body": "Your voice mailbox is almost full. Please dial 52555 to delete some messages and keep receiving new voice message."
  },
  {
    "date": "2026-01-10T08:08:22.470Z",
    "address": "57575701",
    "type": "1",
    "body": "Epic Games: Your verification code is 604060"
  },
  {
    "date": "2026-01-10T07:50:26.549Z",
    "address": "JD-ICICIT-S",
    "type": "1",
    "body": "Rs 6,935.00 spent on ICICI Bank Card XX7003 on 10-Jan-26 at UPI-63762988298. Avl Lmt: Rs 1,88,512.28. To dispute, call 18002662/SMS BLOCK 7003 to 9215676766. To convert this txn to EMI give a missed call on 9924667667. Know more about EMI conversion at https://icici.co/ICICIT/j/29876b76"
  },
  {
    "date": "2026-01-10T07:37:55.432Z",
    "address": "VM-IndiGo-S",
    "type": "1",
    "body": "Hi Ashish, 899044 is your One Time Password. OTP is valid for 5 minutes. Do not share this OTP with anyone. Regards, IndiGo"
  },
  {
    "date": "2026-01-10T05:03:19.321Z",
    "address": "JD-ICICIT-S",
    "type": "1",
    "body": "ICICI Bank Credit Card XX7003 debited for INR 249.00 on 10-Jan-26 for UPI-637622865968-Swiggy. To dispute call 18001080/SMS BLOCK 7003 to 9215676766"
  },
  {
    "date": "2026-01-10T04:58:39.899Z",
    "address": "VM-HDFCBK-S",
    "type": "1",
    "body": "Fingerprint Login Enabled! For HDFC Bank MobileBanking app on 10th Jan. You can now use your fingerprint to log in to the app. Not you? Call 18002586161."
  },
  {
    "date": "2026-01-10T04:58:37.484Z",
    "address": "VM-HDFCBK-S",
    "type": "1",
    "body": "Login Alert! Thank you for using HDFC Bank online banking. Not you? Call 18002586161"
  },
  {
    "date": "2026-01-10T04:58:18.663Z",
    "address": "AD-HDFCBK-S",
    "type": "1",
    "body": "Fingerprint Login Disabled! For HDFC Bank MobileBanking app on 10th Jan. You can now log in using only the mPIN. Not you? Call 18002586161."
  },
  {
    "date": "2026-01-10T04:42:18.488Z",
    "address": "JD-axioLN-S",
    "type": "1",
    "body": "Update Ashish, We have received your timely repayment towards your Pay Later XXX6185 a/c .You can now check your updated personal loan eligibility here https://u.axio.ac/axo/dgWAMSqEYfjve -axio"
  },
  {
    "date": "2026-01-10T02:34:07.428Z",
    "address": "VM-ICICIT-S",
    "type": "1",
    "body": "ICICI Bank Credit Card XX7003 debited for INR 2,162.00 on 10-Jan-26 for UPI-637606839817-UrbanCla. To dispute call 18001080/SMS BLOCK 7003 to 9215676766"
  },
  {
    "date": "2026-01-09T17:54:26.647Z",
    "address": "JD-ICICIT-S",
    "type": "1",
    "body": "INR 1,624.00 spent using ICICI Bank Card XX2003 on 09-Jan-26 on AMAZON PAY IN G. Avl Limit: INR 20,269.35. If not you, call 1800 2662/SMS BLOCK 2003 to 9215676766."
  },
  {
    "date": "2026-01-09T17:53:55.951Z",
    "address": "AD-ICICIO-T",
    "type": "1",
    "body": "198872 is One-Time Password for INR 1624.00 transaction towards AMAZON using ICICI Bank Credit Card XX2003. OTPs are SECRET. DO NOT disclose"
  },
  {
    "date": "2026-01-09T15:24:07.433Z",
    "address": "AD-ICICIT-S",
    "type": "1",
    "body": "ICICI Bank Credit Card XX7003 debited for INR 436.00 on 09-Jan-26 for UPI-637508807779-Swiggy. To dispute call 18001080/SMS BLOCK 7003 to 9215676766"
  },
  {
    "date": "2026-01-09T12:52:31.174Z",
    "address": "CP-POLBAZ-S",
    "type": "1",
    "body": "Hi Ashish Tripathif, Ref. ID- 1033750530 Your Twowheeler Insurance policy has been issued. Download your digitally signed soft copy here https://epbz.in/POLBAZ/fZc/fZcBn Use it as your legal document for police verification on demand. No need for a hard copy."
  },
  {
    "date": "2026-01-09T07:18:42.291Z",
    "address": "+917448904802",
    "type": "1",
    "body": "Hi! You missed a call from +917448904802.Last call:09-01-2026 12:48:32."
  },
  {
    "date": "2026-01-09T07:18:36.767Z",
    "address": "AA-AIRVMS-S",
    "type": "1",
    "body": "Your voice mailbox is almost full. Please dial 52555 to delete some messages and keep receiving new voice message."
  },
  {
    "date": "2026-01-09T05:20:15.357Z",
    "address": "+919620051345",
    "type": "1",
    "body": "Hi! You missed a call from +919620051345.Last call:09-01-2026 10:50:03."
  },
  {
    "date": "2026-01-09T05:20:07.483Z",
    "address": "AA-AIRVMS-S",
    "type": "1",
    "body": "Your voice mailbox is almost full. Please dial 52555 to delete some messages and keep receiving new voice message."
  },
  {
    "date": "2026-01-09T02:31:29.205Z",
    "address": "CP-POLBAZ-S",
    "type": "1",
    "body": "Your two wheeler policy application is incomplete. Upload RC to complete policy issuance, click https://epbz.in/POLBAZ/fP7/fP7F3. Policybazaar Insurance Brokers. T&C"
  },
  {
    "date": "2026-01-08T17:59:49.482Z",
    "address": "VM-AMEXIN-S",
    "type": "1",
    "body": "Alert: You've spent INR 4,411.00 on your AMEX Corp Card ** 21006 at CWT INDIA on 8 January 2026 at 11:29 PM IST. Call 18004190691 if this was not made by you."
  },
  {
    "date": "2026-01-08T17:35:00.506Z",
    "address": "JX-ICICIT-S",
    "type": "1",
    "body": "ICICI Bank Credit Card XX7003 debited for INR 1,460.00 on 08-Jan-26 for UPI-637414661564-UrbanCla. To dispute call 18001080/SMS BLOCK 7003 to 9215676766"
  },
  {
    "date": "2026-01-08T15:06:31.931Z",
    "address": "JM-Pluxee-S",
    "type": "1",
    "body": "Rs. 289.00 spent from Pluxee  Meal Card wallet, card no.xx9013 on 8-01-2026 20:36:12 at SWIGGY INST . Avl bal Rs.2932.23. Not you call 18002106919"
  },
  {
    "date": "2026-01-08T14:21:09.970Z",
    "address": "VM-ICICIT-S",
    "type": "1",
    "body": "ICICI Bank Credit Card XX7003 debited for INR 865.00 on 08-Jan-26 for UPI-637428625229-Policyba. To dispute call 18001080/SMS BLOCK 7003 to 9215676766"
  },
  {
    "date": "2026-01-08T14:21:00.914Z",
    "address": "JD-POLBAZ-S",
    "type": "1",
    "body": "Payment of Rs. 865.0  is successful for purchase of your TwoWheeler policy. Please login to MYACCOUNT for any queries - https://epbz.in/POLBAZ/iZ6/6bMND  .- Team PolicyBazaar"
  },
  {
    "date": "2026-01-08T14:08:33.775Z",
    "address": "CP-POLBAZ-S",
    "type": "1",
    "body": "Dear User, 768195 is your secure OTP for Policybazaar login. It expires in 10 minutes. Never share this OTP with anyone. - Team Policybazaar"
  },
  {
    "date": "2026-01-08T12:55:56.595Z",
    "address": "CP-PTNNPS-S",
    "type": "1",
    "body": "PRAN XX5796: Units for Voluntary contribution of Rs.5,000.00 credited with NAV of 07/01/26 -Protean"
  },
  {
    "date": "2026-01-08T11:48:49.751Z",
    "address": "VA-ICICIT-S",
    "type": "1",
    "body": "ICICI Bank Credit Card XX7003 debited for INR 30.00 on 08-Jan-26 for UPI-637415601590-ALTAF. To dispute call 18001080/SMS BLOCK 7003 to 9215676766"
  },
  {
    "date": "2026-01-08T10:26:12.602Z",
    "address": "JD-ICICIT-S",
    "type": "1",
    "body": "ICICI Bank Credit Card XX7003 debited for INR 513.45 on 08-Jan-26 for UPI-637405581992-DUNKIN. To dispute call 18001080/SMS BLOCK 7003 to 9215676766"
  },
  {
    "date": "2026-01-08T09:17:05.783Z",
    "address": "+916361116880",
    "type": "1",
    "body": "Hi! You missed a call from +916361116880.Last call:08-01-2026 14:46:57."
  },
  {
    "date": "2026-01-08T09:17:01.200Z",
    "address": "AA-AIRVMS-S",
    "type": "1",
    "body": "Your voice mailbox is almost full. Please dial 52555 to delete some messages and keep receiving new voice message."
  },
  {
    "date": "2026-01-08T09:17:00.128Z",
    "address": "+916361116880",
    "type": "2",
    "body": "I'll call you back."
  },
  {
    "date": "2026-01-08T05:14:36.055Z",
    "address": "+917449014922",
    "type": "1",
    "body": "Hi! You missed a call from +917449014922.Last call:08-01-2026 10:44:26."
  },
  {
    "date": "2026-01-08T05:14:29.566Z",
    "address": "AA-AIRVMS-S",
    "type": "1",
    "body": "Your voice mailbox is almost full. Please dial 52555 to delete some messages and keep receiving new voice message."
  },
  {
    "date": "2026-01-07T16:17:22.012Z",
    "address": "JD-ICICIT-S",
    "type": "1",
    "body": "INR 1,499.00 spent using ICICI Bank Card XX2003 on 07-Jan-26 on AMAZON. Avl Limit: INR 21,893.35. If not you, call 1800 2662/SMS BLOCK 2003 to 9215676766."
  },
  {
    "date": "2026-01-07T16:17:14.280Z",
    "address": "AX-LIVCNF-S",
    "type": "1",
    "body": "Yay! Your LIV Premium subscription is now active on 7607433733. Order ID: 946031026. Your subscription will auto-renew on 07 Jan 2027 -Sony LIV"
  },
  {
    "date": "2026-01-07T16:17:05.121Z",
    "address": "JX-ICICIT-S",
    "type": "1",
    "body": "Dear Customer, we have activated Standing Instructions on your ICICI Bank Credit Card 2003. Merchant: Amazon, Maximum Amount: INR 5000.00, Frequency: annual, Start Date: 07/01/2026, End Date: 07/01/2031, Mandate ID: YESiillfCD. To manage your Standing Instructions, visit www.icicibank.com >Cards>Credit Cards>Standing Instructions and Recurring Charges>Manage Standing Instructions."
  },
  {
    "date": "2026-01-07T16:16:33.009Z",
    "address": "AX-ICICIO-T",
    "type": "1",
    "body": "372415 is One-Time Password for INR 1499.00 transaction towards AMAZON using ICICI Bank Credit Card XX2003. OTPs are SECRET. DO NOT disclose"
  },
  {
    "date": "2026-01-07T13:58:11.650Z",
    "address": "CP-ICICIT-S",
    "type": "1",
    "body": "Important update regarding changes to the features and charges of your ICICI Bank Credit Card XX7003. Visit icici.co/ICICIT/k/DUvOdDSPDM1   for details."
  },
  {
    "date": "2026-01-07T13:57:49.866Z",
    "address": "CP-ICICIT-S",
    "type": "1",
    "body": "Important update regarding changes to the features and charges of your ICICI Bank Credit Card XX2003. Visit icici.co/ICICIT/k/DUvOdDSPDM1   for details."
  },
  {
    "date": "2026-01-07T12:54:33.688Z",
    "address": "AD-ICICIO-T",
    "type": "1",
    "body": "190219 is One-Time Password for INR 6305.00 transaction towards INDIGO AIRL using ICICI Bank Credit Card XX7003. OTPs are SECRET. DO NOT disclose"
  },
  {
    "date": "2026-01-07T12:47:31.790Z",
    "address": "VA-IndiGo-S",
    "type": "1",
    "body": "Hi Ashish, 431276 is your One Time Password. OTP is valid for 5 minutes. Do not share this OTP with anyone. Regards, IndiGo"
  },
  {
    "date": "2026-01-07T12:46:31.179Z",
    "address": "+918792975702",
    "type": "1",
    "body": "Hi! You missed a call from +918792975702.Last call:07-01-2026 18:16:25."
  },
  {
    "date": "2026-01-07T12:46:27.478Z",
    "address": "AA-AIRVMS-S",
    "type": "1",
    "body": "Your voice mailbox is almost full. Please dial 52555 to delete some messages and keep receiving new voice message."
  },
  {
    "date": "2026-01-07T06:00:17.179Z",
    "address": "JX-PHONPE-S",
    "type": "1",
    "body": "ZERODHA BROKING LTD has requested money from you on PhonePe.Rs.250 will be debited from your account on approving the request - https://phone.pe/PHONPE/g5m7sixa"
  },
  {
    "date": "2026-01-07T05:51:57.704Z",
    "address": "AD-ZRODHA-S",
    "type": "1",
    "body": "312961 is your OTP / verification code for Kite and is valid for 5 minutes. Do not share this with anyone. -Zerodha"
  },
  {
    "date": "2026-01-06T23:33:35.641Z",
    "address": "JD-IDFCFB-S",
    "type": "1",
    "body": "Dear Customer, Your beneficiary has received Rs 5,000.00 transferred via NEFT IDFBH26007759490. Team IDFC First Bank."
  },
  {
    "date": "2026-01-06T23:17:08.757Z",
    "address": "JD-IDFCFB-S",
    "type": "1",
    "body": "IDFC FIRST Bank A/c XX7696 debited with Rs 5,000.00 on 07/01/26 via NEFT/IDFBH26007759490. New bal Rs.1,38,202.65. To raise Dispute, call 180010888"
  },
  {
    "date": "2026-01-06T16:00:04.844Z",
    "address": "AD-LIVOTP-S",
    "type": "1",
    "body": "Sony LIV OTP is 1001, Use this to verify your mobile. -Sony LIV"
  },
  {
    "date": "2026-01-06T15:32:47.288Z",
    "address": "AX-ICICIT-S",
    "type": "1",
    "body": "ICICI Bank Credit Card XX7003 debited for INR 184.00 on 06-Jan-26 for UPI-637224332379-ADISHWAR. To dispute call 18001080/SMS BLOCK 7003 to 9215676766"
  },
  {
    "date": "2026-01-06T14:43:05.937Z",
    "address": "VM-ICICIT-S",
    "type": "1",
    "body": "Rs 5,953.00 spent on ICICI Bank Card XX7003 on 06-Jan-26 at UPI-63722531399. Avl Lmt: Rs 2,01,351.73. To dispute, call 18002662/SMS BLOCK 7003 to 9215676766. To convert this txn to EMI give a missed call on 9924667667. Know more about EMI conversion at https://icici.co/ICICIT/y15woa"
  },
  {
    "date": "2026-01-06T10:06:00.554Z",
    "address": "VM-AMEXIN-S",
    "type": "1",
    "body": "Alert: You've spent INR 1.00 on your AMEX Corp Card ** 21006 at CWT PG on 6 January 2026 at 03:35 PM IST. Call 18004190691 if this was not made by you."
  },
  {
    "date": "2026-01-06T10:04:55.661Z",
    "address": "VM-MYAMEX-S",
    "type": "1",
    "body": "Your Amex SafeKey One-Time Password for INR 1.00, at CWT PG is 174721. Valid for 10 mins for Card ending  21006. Do not disclose it to anyone."
  },
  {
    "date": "2026-01-06T10:01:32.206Z",
    "address": "VM-MYAMEX-S",
    "type": "1",
    "body": "370049 is your one-time passcode from American Express."
  },
  {
    "date": "2026-01-06T09:37:01.300Z",
    "address": "VM-RBLCRD-S",
    "type": "1",
    "body": "Stay alert when using your card online! Report any suspicious or unauthorized activity instantly via the RBL Mycard app call us at 022-62327777 -RBL Bank"
  },
  {
    "date": "2026-01-06T06:19:23.868Z",
    "address": "AX-PHONPE-S",
    "type": "1",
    "body": "sonyliv has sent you an AutoPay request for up to Rs. 1499. Click to approve this request now: https://phone.pe/PHONPE/2rw8d9yw"
  },
  {
    "date": "2026-01-06T06:15:45.952Z",
    "address": "AX-LIVOTP-S",
    "type": "1",
    "body": "Sony LIV OTP is 4091, Use this to verify your mobile. -Sony LIV"
  },
  {
    "date": "2026-01-06T06:00:11.592Z",
    "address": "AD-LIVOTP-S",
    "type": "1",
    "body": "Sony LIV OTP is 8355, Use this to verify your mobile. -Sony LIV"
  },
  {
    "date": "2026-01-06T05:51:40.987Z",
    "address": "AX-LIVCNF-S",
    "type": "1",
    "body": "Yay! Your Mobile Only subscription is now active on 7607433733. Order ID: 943868302. Your subscription will auto-renew on 06 Jan 2027 -Sony LIV"
  },
  {
    "date": "2026-01-06T05:51:11.632Z",
    "address": "AX-PHONPE-S",
    "type": "1",
    "body": "sonyliv has sent you an AutoPay request for up to Rs. 699. Click to approve this request now: https://phone.pe/PHONPE/a7u4h75p"
  },
  {
    "date": "2026-01-06T05:50:09.303Z",
    "address": "AX-LIVOTP-S",
    "type": "1",
    "body": "Sony LIV OTP is 8052, Use this to verify your mobile. -Sony LIV"
  },
  {
    "date": "2026-01-06T04:25:06.724Z",
    "address": "JD-MLKBKT-S",
    "type": "1",
    "body": "Dear Customer, your Milkbasket top-up was successful! Your account has been credited with Rs. 2000.0 on 2026-01-06 09:55:01. New Balance: Rs 2019.51. Thank you!"
  },
  {
    "date": "2026-01-06T03:45:52.393Z",
    "address": "JD-Pluxee-S",
    "type": "1",
    "body": "Rs. 215.00 spent from Pluxee  Meal Card wallet, card no.xx9013 on 6-01-2026 9:15:39 at SWIGGY INST . Avl bal Rs.3221.23. Not you call 18002106919"
  },
  {
    "date": "2026-01-05T23:38:56.473Z",
    "address": "VA-EPFOHO-G",
    "type": "1",
    "body": "EPFO YouTube is now @officialepfo. Please join to youtube.com/@officialepfo to watch informative videos on latest updates on EPF, Pension and EDLI. Team EPFO"
  },
  {
    "date": "2026-01-05T15:53:42.283Z",
    "address": "AA-Airtel-S",
    "type": "1",
    "body": "Thanks for calling Airtel call center. We'd like to hear about your recent experience. To share your valuable feedback, click on the link : https://nps.airtel.in/fmp/nps?sNo=3frYHkfzrGPC2YIskGMtRA==&type=post"
  },
  {
    "date": "2026-01-05T15:15:42.328Z",
    "address": "JM-TKTALT-S",
    "type": "1",
    "body": "We are happy to have you as our valued customer. Your account has been successfully activated. UserName is your mobile number and the password is Bbczwd$103. Change your password on your first login. - OTA Platform"
  },
  {
    "date": "2026-01-05T06:37:34.303Z",
    "address": "JM-Pluxee-S",
    "type": "1",
    "body": "Your Pluxee Card has been successfully credited with Rs.2200 towards  Meal Wallet on Mon Jan 05 2026 12:01:55. Your current Meal Wallet balance is Rs.3436.23."
  },
  {
    "date": "2026-01-05T06:12:09.446Z",
    "address": "AD-AIRWRK-S",
    "type": "1",
    "body": "Hi, please provide the Airtel - Service code 0876 to engineer once the technical issue has been resolved. To get 100% Wi-Fi Coverage at your home, click www.airtel.in/wifi-coverage-plus ."
  },
  {
    "date": "2026-01-05T06:12:07.463Z",
    "address": "AD-AIRWRK-S",
    "type": "1",
    "body": "Hi, please provide the Airtel - Service code 0876 to engineer once the technical issue has been resolved. To get 100% Wi-Fi Coverage at your home, click www.airtel.in/wifi-coverage-plus ."
  },
  {
    "date": "2026-01-05T06:09:15.629Z",
    "address": "AD-AIRWRK-S",
    "type": "1",
    "body": "Hi, please provide the Airtel - Service code 0876 to engineer once the technical issue has been resolved. To get 100% Wi-Fi Coverage at your home, click www.airtel.in/wifi-coverage-plus ."
  },
  {
    "date": "2026-01-05T06:08:39.374Z",
    "address": "AD-AIRWRK-S",
    "type": "1",
    "body": "Hi AshishTripathi, App link sent to your mobile number please download Thanks App using this Link"
  },
  {
    "date": "2026-01-05T03:31:48.159Z",
    "address": "AD-AIRWRK-S",
    "type": "1",
    "body": "Hi, your service request 11022537451 has been assigned to engineer ADITHYA M (08048258531). He will contact you on 05-Jan-2026 between 12:00 PM - 01:00 PM. To track your request or reschedule appointment as per your availability, click i.airtel.in/trackreq"
  },
  {
    "date": "2026-01-05T02:19:03.730Z",
    "address": "AE-AIRSBL-S",
    "type": "1",
    "body": "Thank you for contacting us. The request no. for your Airtel Wi-Fi ID 08027590982_wifi is 11022537451. It is our constant endeavor to help you stay connected. To track your request, click https://www.airtel.in/5/trckrqst"
  },
  {
    "date": "2026-01-05T02:18:56.988Z",
    "address": "AD-AIRWRK-S",
    "type": "1",
    "body": "Hi, your service request 11022537451 has been assigned to engineer ADITHYA M (08048258531). He will contact you on 05-Jan-2026 between 09:00 AM - 10:00 AM. To track your request or reschedule appointment as per your availability, click i.airtel.in/trackreq"
  },
  {
    "date": "2026-01-05T02:14:14.171Z",
    "address": "AD-AIRTEL-S",
    "type": "1",
    "body": "For quick Airtel Wi-Fi support, chat with us on WhatsApp: https://wa.me/+919205182984?text=Hi. Watch this video to know how to optimize and reboot your Wi-Fi improved performance- https://youtu.be/YqOp0CrB4PQ"
  },
  {
    "date": "2026-01-04T11:15:23.850Z",
    "address": "JM-ICICIT-S",
    "type": "1",
    "body": "ICICI Bank Credit Card XX7003 debited for INR 1,141.00 on 04-Jan-26 for UPI-637092831092-TANDOORI. To dispute call 18001080/SMS BLOCK 7003 to 9215676766"
  },
  {
    "date": "2026-01-04T10:27:45.211Z",
    "address": "JK-PANTLS-S",
    "type": "1",
    "body": "Hello! We love that you found what you were looking for at Pantaloons. Pls take a few seconds & help us know you better, click s.cplry.com/MzI0NTgyNzc2KzE ."
  },
  {
    "date": "2026-01-04T10:26:44.115Z",
    "address": "JM-PANTLS-S",
    "type": "1",
    "body": "Dear customer thank you for shopping with Pantaloons. Please click the link to view your e-bill https://knvl.me/PANTLS/UfeAwXM"
  },
  {
    "date": "2026-01-04T09:39:12.661Z",
    "address": "JM-RBLCRD-S",
    "type": "1",
    "body": "INR998.00 spent at WESTSIDE on RBL Bank credit card (6089) on 04-01-2026.AVL limit- INR309,504.93. Not you? Call 02262327777 "
  },
  {
    "date": "2026-01-04T08:39:20.377Z",
    "address": "AX-ICICIT-S",
    "type": "1",
    "body": "ICICI Bank Credit Card XX7003 debited for INR 30.00 on 04-Jan-26 for UPI-637021901493-ETERNAL. To dispute call 18001080/SMS BLOCK 7003 to 9215676766"
  },
  {
    "date": "2026-01-04T08:30:06.605Z",
    "address": "JM-RBLCRD-S",
    "type": "1",
    "body": "INR2,048.00 spent at M S MODENIK LIFESTYLE on RBL Bank credit card (6089) on 04-01-2026.AVL limit- INR310,502.93. Not you? Call 02262327777 "
  },
  {
    "date": "2026-01-04T08:29:26.203Z",
    "address": "VM-HDFCBK-S",
    "type": "1",
    "body": "HDFC Bank Loan Ac no. xxx130 - INSTALLMENT of RS.44734 NACH scheduled for debit on 05-jan-26 from Bank Ac no 31xxx760. Please maintain sufficient funds."
  },
  {
    "date": "2026-01-04T04:34:20.057Z",
    "address": "VM-axioLN-S",
    "type": "1",
    "body": "*Reminder* by continuing to make timely EMI payments against your Pay Later a/c, you are building a strong credit score. You can now avail a quick personal loan. Click to know more https://u.axio.ac/axo/dgWAMSqEYfjve -axio"
  },
  {
    "date": "2026-01-04T04:28:12.983Z",
    "address": "+912264198793",
    "type": "1",
    "body": "Hi! You missed a call from +912264198793.Last call:04-01-2026 09:58:07."
  },
  {
    "date": "2026-01-04T04:28:08.829Z",
    "address": "AA-AIRVMS-S",
    "type": "1",
    "body": "Your voice mailbox is almost full. Please dial 52555 to delete some messages and keep receiving new voice message."
  },
  {
    "date": "2026-01-04T04:01:39.685Z",
    "address": "AX-ICICIT-S",
    "type": "1",
    "body": "ICICI Bank Credit Card XX7003 debited for INR 10.00 on 04-Jan-26 for UPI-637010852751-PAVITHRA. To dispute call 18001080/SMS BLOCK 7003 to 9215676766"
  },
  {
    "date": "2026-01-04T03:26:13.326Z",
    "address": "JD-ICICIT-S",
    "type": "1",
    "body": "INR 1,004.00 spent using ICICI Bank Card XX2003 on 04-Jan-26 on AMAZON PAY IN E. Avl Limit: INR 23,392.35. If not you, call 1800 2662/SMS BLOCK 2003 to 9215676766."
  },
  {
    "date": "2026-01-04T03:25:55.701Z",
    "address": "AD-ICICIO-T",
    "type": "1",
    "body": "611459 is One-Time Password for INR 1004.00 transaction towards AMAZON using ICICI Bank Credit Card XX2003. OTPs are SECRET. DO NOT disclose"
  },
  {
    "date": "2026-01-04T02:58:50.216Z",
    "address": "VM-HDFCBK-S",
    "type": "1",
    "body": "HDFC Bank Loan Ac no. xxx781 - INSTALLMENT of RS.12506 NACH scheduled for debit on 05-jan-26 from Bank Ac no 50xxx453. Please maintain sufficient funds."
  },
  {
    "date": "2026-01-03T14:53:35.334Z",
    "address": "JM-ICICIT-S",
    "type": "1",
    "body": "ICICI Bank Credit Card XX7003 debited for INR 40.00 on 03-Jan-26 for UPI-636909793760-BABULLA. To dispute call 18001080/SMS BLOCK 7003 to 9215676766"
  },
  {
    "date": "2026-01-03T14:50:25.029Z",
    "address": "JD-ICICIT-S",
    "type": "1",
    "body": "ICICI Bank Credit Card XX7003 debited for INR 121.00 on 03-Jan-26 for UPI-636925793901-THEOBROM. To dispute call 18001080/SMS BLOCK 7003 to 9215676766"
  },
  {
    "date": "2026-01-03T14:24:43.519Z",
    "address": "AD-ICICIT-S",
    "type": "1",
    "body": "ICICI Bank Credit Card XX7003 debited for INR 30.00 on 03-Jan-26 for UPI-636919781261-DINESH. To dispute call 18001080/SMS BLOCK 7003 to 9215676766"
  },
  {
    "date": "2026-01-03T12:23:00.251Z",
    "address": "+918291930841",
    "type": "1",
    "body": "Hi! You missed a call from +918291930841.Last call:03-01-2026 17:52:54."
  },
  {
    "date": "2026-01-03T12:22:55.186Z",
    "address": "AA-AIRVMS-S",
    "type": "1",
    "body": "Your voice mailbox is almost full. Please dial 52555 to delete some messages and keep receiving new voice message."
  },
  {
    "date": "2026-01-03T06:54:07.956Z",
    "address": "+918124886128",
    "type": "1",
    "body": "Hi! You missed a call from +918124886128.Last call:03-01-2026 12:24:02."
  },
  {
    "date": "2026-01-03T06:54:02.734Z",
    "address": "AA-AIRVMS-S",
    "type": "1",
    "body": "Your voice mailbox is almost full. Please dial 52555 to delete some messages and keep receiving new voice message."
  },
  {
    "date": "2026-01-03T06:11:56.186Z",
    "address": "AD-LENSKT-S",
    "type": "1",
    "body": "<#> 6259  is your One Time Password (OTP) for Lenskart. OTP is valid for 15 mins. kYp4fg8LQfy"
  },
  {
    "date": "2026-01-03T05:44:06.160Z",
    "address": "VM-Pluxee-S",
    "type": "1",
    "body": "Rs. 418.00 spent from Pluxee  Meal Card wallet, card no.xx9013 on 3-01-2026 11:13:52 at SWIGGY INST . Avl bal Rs.1236.23. Not you call 18002106919"
  },
  {
    "date": "2026-01-03T04:12:28.603Z",
    "address": "JM-ICICIT-S",
    "type": "1",
    "body": "ICICI Bank Credit Card XX7003 debited for INR 80.00 on 03-Jan-26 for UPI-636926655097-M S RAMD. To dispute call 18001080/SMS BLOCK 7003 to 9215676766"
  },
  {
    "date": "2026-01-02T16:40:28.729Z",
    "address": "JD-Pluxee-S",
    "type": "1",
    "body": "Rs. 172.00 spent from Pluxee  Meal Card wallet, card no.xx9013 on 2-01-2026 22:10:25 at SWIGGY . Avl bal Rs.1654.23. Not you call 18002106919"
  },
  {
    "date": "2026-01-02T12:51:01.869Z",
    "address": "AD-TRAIND-G",
    "type": "1",
    "body": "Report spam for action against spammers. However, blocking spammer on calling app of phone does not lead to action against spammer. Report spam on TRAI DND App or service provider App or 1909. Reporting on TRAI DND App is easy and quick, install today."
  },
  {
    "date": "2026-01-01T14:39:43.372Z",
    "address": "JD-Pluxee-S",
    "type": "1",
    "body": "Rs. 342.00 spent from Pluxee  Meal Card wallet, card no.xx9013 on 1-01-2026 20:09:35 at SWIGGY . Avl bal Rs.1826.23. Not you call 18002106919"
  },
  {
    "date": "2026-01-01T12:46:37.431Z",
    "address": "AD-ICICIT-S",
    "type": "1",
    "body": "ICICI Bank Credit Card XX7003 debited for INR 218.00 on 01-Jan-26 for UPI-636708385346-Blinkit. To dispute call 18001080/SMS BLOCK 7003 to 9215676766"
  },
  {
    "date": "2026-01-01T12:13:39.145Z",
    "address": "AA-AIRVMS-S",
    "type": "1",
    "body": "Your voice mailbox is almost full. Please dial 52555 to delete some messages and keep receiving new voice message."
  },
  {
    "date": "2026-01-01T12:13:31.539Z",
    "address": "+918765196102",
    "type": "1",
    "body": "Hi! You missed a call from +918765196102.Last call:01-01-2026 17:43:28."
  },
  {
    "date": "2026-01-01T10:59:20.266Z",
    "address": "AD-ICICIT-S",
    "type": "1",
    "body": "ICICI Bank Credit Card XX7003 Statement is sent to as*********am@gmail.com. Total of Rs 34,915.61 or minimum of Rs 1,750.00 is due by 12-JAN-26."
  },
  {
    "date": "2026-01-01T08:20:12.102Z",
    "address": "JD-ICICIT-S",
    "type": "1",
    "body": "ICICI Bank Credit Card XX7003 debited for INR 460.00 on 01-Jan-26 for UPI-636720334769-Swiggy. To dispute call 18001080/SMS BLOCK 7003 to 9215676766"
  },
  {
    "date": "2026-01-01T07:24:52.451Z",
    "address": "JD-IDFCFB-S",
    "type": "1",
    "body": "Monthly interest of Rs.264.00 earned on your Savings A/c XX7696 has been credited to your A/C on 31/12/25. New bal: Rs.1,43,202.65. IDFC FIRST Bank"
  },
  {
    "date": "2026-01-01T07:17:15.455Z",
    "address": "+918031314653",
    "type": "1",
    "body": "Hi! You missed a call from +918031314653.Last call:01-01-2026 12:47:06."
  },
  {
    "date": "2026-01-01T07:17:09.565Z",
    "address": "AA-AIRVMS-S",
    "type": "1",
    "body": "Your voice mailbox is almost full. Please dial 52555 to delete some messages and keep receiving new voice message."
  },
  {
    "date": "2026-01-01T07:16:03.404Z",
    "address": "+918035792690",
    "type": "1",
    "body": "Hi! You missed a call from +918035792690.Last call:01-01-2026 12:46:00."
  },
  {
    "date": "2026-01-01T07:16:02.796Z",
    "address": "AA-AIRVMS-S",
    "type": "1",
    "body": "Your voice mailbox is almost full. Please dial 52555 to delete some messages and keep receiving new voice message."
  },
  {
    "date": "2026-01-01T07:15:42.892Z",
    "address": "+918031314653",
    "type": "1",
    "body": "Hi! You missed a call from +918031314653.Last call:01-01-2026 12:45:35."
  },
  {
    "date": "2026-01-01T07:15:37.851Z",
    "address": "AA-AIRVMS-S",
    "type": "1",
    "body": "Your voice mailbox is almost full. Please dial 52555 to delete some messages and keep receiving new voice message."
  },
  {
    "date": "2026-01-01T07:13:17.116Z",
    "address": "+918031314653",
    "type": "1",
    "body": "Hi! You missed a call from +918031314653.Last call:01-01-2026 12:43:08."
  },
  {
    "date": "2026-01-01T07:13:09.635Z",
    "address": "AA-AIRVMS-S",
    "type": "1",
    "body": "Your voice mailbox is almost full. Please dial 52555 to delete some messages and keep receiving new voice message."
  },
  {
    "date": "2026-01-01T07:09:27.275Z",
    "address": "AA-AIRVMS-S",
    "type": "1",
    "body": "Your voice mailbox is almost full. Please dial 52555 to delete some messages and keep receiving new voice message."
  },
  {
    "date": "2026-01-01T07:09:24.648Z",
    "address": "+918031314653",
    "type": "1",
    "body": "Hi! You missed a call from +918031314653.Last call:01-01-2026 12:39:22."
  },
  {
    "date": "2026-01-01T07:08:09.087Z",
    "address": "+918035792690",
    "type": "1",
    "body": "Hi! You missed a call from +918035792690.Last call:01-01-2026 12:38:06."
  },
  {
    "date": "2026-01-01T07:08:07.919Z",
    "address": "AA-AIRVMS-S",
    "type": "1",
    "body": "Your voice mailbox is almost full. Please dial 52555 to delete some messages and keep receiving new voice message."
  },
  {
    "date": "2026-01-01T07:07:23.187Z",
    "address": "+918031314653",
    "type": "1",
    "body": "Hi! You missed a call from +918031314653.Last call:01-01-2026 12:37:18."
  },
  {
    "date": "2026-01-01T07:07:20.780Z",
    "address": "AA-AIRVMS-S",
    "type": "1",
    "body": "Your voice mailbox is almost full. Please dial 52555 to delete some messages and keep receiving new voice message."
  },
  {
    "date": "2026-01-01T07:05:40.185Z",
    "address": "+918031314653",
    "type": "1",
    "body": "Hi! You missed a call from +918031314653.Last call:01-01-2026 12:35:29."
  },
  {
    "date": "2026-01-01T07:05:33.089Z",
    "address": "AA-AIRVMS-S",
    "type": "1",
    "body": "Your voice mailbox is almost full. Please dial 52555 to delete some messages and keep receiving new voice message."
  },
  {
    "date": "2026-01-01T05:25:18.142Z",
    "address": "AD-AIRTEL-S",
    "type": "1",
    "body": "We are committed to make your experience beautiful with Airtel. For any assistance, please contact our team of expert advisors by dialing 198/121 from your Airtel number. In case if you are not satisfied with the resolution provided by the call centre, you can contact the Appellate authority on the same number."
  },
  {
    "date": "2026-01-01T04:30:02.232Z",
    "address": "VM-LICIND-S",
    "type": "1",
    "body": "LIC           8976862090  \"Hi\"        LIC DIVE   -LIC"
  },
  {
    "date": "2025-12-31T15:03:55.956Z",
    "address": "JM-IRSMSA-G",
    "type": "1",
    "body": "Dear Passenger, You can check on-board food menu options at: https://menurates.irctc.co.in/ IR-CRIS"
  },
  {
    "date": "2025-12-31T10:07:58.974Z",
    "address": "AX-ICICIT-S",
    "type": "1",
    "body": "ICICI Bank Credit Card XX7003 debited for INR 1,886.00 on 31-Dec-25 for UPI-573112142517-THE BALA. To dispute call 18001080/SMS BLOCK 7003 to 9215676766"
  },
  {
    "date": "2025-12-31T04:21:45.142Z",
    "address": "AX-ICICIT-S",
    "type": "1",
    "body": "ICICI Bank Credit Card XX7003 debited for INR 400.00 on 31-Dec-25 for UPI-573100076124-MR SHAHA. To dispute call 18001080/SMS BLOCK 7003 to 9215676766"
  },
  {
    "date": "2025-12-31T00:33:03.344Z",
    "address": "AX-IRCTCi-S",
    "type": "1",
    "body": "Namaskar Vande Bharat Guest, Your meal plan booked for upcoming journey with PNR 4850927993 is - Passengers 1,2,3,4,5,6-Morning Tea + Breakfast + Lunch. Have a happy journey. -IRCTC"
  },
  {
    "date": "2025-12-30T18:01:51.515Z",
    "address": "AD-ICICIT-S",
    "type": "1",
    "body": "ICICI Bank Credit Card XX7003 debited for INR 585.00 on 30-Dec-25 for UPI-573026046154-SANGAM. To dispute call 18001080/SMS BLOCK 7003 to 9215676766"
  },
  {
    "date": "2025-12-30T17:18:00.610Z",
    "address": "AX-PSCLTN-S",
    "type": "1",
    "body": "Dear Ashish Tripathi , your ferry ticket P-12230664 has been canceled by you. Refund of 1500.00 will be processed soon. - Poompuhar Shipping Corporation"
  },
  {
    "date": "2025-12-30T17:17:09.811Z",
    "address": "AX-PSCLTN-S",
    "type": "1",
    "body": "355142 is your OTP to login for book the ferry tickets. Ref.Id: LY - Poompuhar Shipping Corporation"
  },
  {
    "date": "2025-12-30T17:14:33.588Z",
    "address": "AD-UIICHO-S",
    "type": "1",
    "body": "Dear Customer, PNR 4850927993; PA Insurance Certificate/s mailed; Premium Rs. 2.70. For policy & to update nominee visit https://ui1.in/UIICHO/DY6K4r -Team United India"
  },
  {
    "date": "2025-12-30T17:11:30.695Z",
    "address": "AX-IRCTCi-S",
    "type": "1",
    "body": "Namaskar Vande Bharat Guest, Your meal plan booked for upcoming journey with PNR 4850927993 is - Passengers 1,2,3,4,5,6-Morning Tea + Breakfast + Lunch. Have a happy journey. -IRCTC"
  },
  {
    "date": "2025-12-30T13:03:38.723Z",
    "address": "AX-ICICIT-S",
    "type": "1",
    "body": "ICICI Bank Credit Card XX7003 debited for INR 90.00 on 30-Dec-25 for UPI-630943291010-KOHILA. To dispute call 18001080/SMS BLOCK 7003 to 9215676766"
  },
  {
    "date": "2025-12-30T12:58:18.088Z",
    "address": "AX-ICICIT-S",
    "type": "1",
    "body": "ICICI Bank Credit Card XX7003 debited for INR 150.00 on 30-Dec-25 for UPI-609596602550-Ragupath. To dispute call 18001080/SMS BLOCK 7003 to 9215676766"
  },
  {
    "date": "2025-12-30T12:17:57.919Z",
    "address": "JD-ICICIT-S",
    "type": "1",
    "body": "ICICI Bank Credit Card XX7003 debited for INR 66.00 on 30-Dec-25 for UPI-344527065638-PAVALAKO. To dispute call 18001080/SMS BLOCK 7003 to 9215676766"
  },
  {
    "date": "2025-12-30T12:17:44.183Z",
    "address": "AX-PHONPE-S",
    "type": "1",
    "body": "You've paid Rs.14 via PhonePe gift card to PAVALAKODI on Dec 30, 2025 at 5:47:36 PM. Not you? Call us on 022-68727374. Remaining balance Rs.0."
  },
  {
    "date": "2025-12-30T09:15:08.740Z",
    "address": "AD-ICICIT-S",
    "type": "1",
    "body": "ICICI Bank Credit Card XX7003 debited for INR 1,995.00 on 30-Dec-25 for UPI-486529856933-DAK TRAD. To dispute call 18001080/SMS BLOCK 7003 to 9215676766"
  },
  {
    "date": "2025-12-30T06:09:23.262Z",
    "address": "AD-ICICIT-S",
    "type": "1",
    "body": "UPI-573028905841-HOTEL RA refund of Rs 2,330.00 credited to ICICI Bank Credit Card XX7003 on 30-DEC-25. Revised total due Rs 0, minimum due Rs .00"
  },
  {
    "date": "2025-12-30T06:09:18.975Z",
    "address": "AD-ICICIT-S",
    "type": "1",
    "body": "UPI-573013917196-HOTEL RA refund of Rs 2,330.00 credited to ICICI Bank Credit Card XX7003 on 30-DEC-25. Revised total due Rs 0, minimum due Rs .00"
  },
  {
    "date": "2025-12-30T04:54:43.997Z",
    "address": "AD-ICICIT-S",
    "type": "1",
    "body": "ICICI Bank Credit Card XX7003 debited for INR 2,330.00 on 30-Dec-25 for UPI-573028905841-HOTEL. To dispute call 18001080/SMS BLOCK 7003 to 9215676766"
  },
  {
    "date": "2025-12-30T04:54:37.876Z",
    "address": "AD-ICICIT-S",
    "type": "1",
    "body": "ICICI Bank Credit Card XX7003 debited for INR 2,330.00 on 30-Dec-25 for UPI-573013917196-HOTEL. To dispute call 18001080/SMS BLOCK 7003 to 9215676766"
  },
  {
    "date": "2025-12-30T02:14:10.587Z",
    "address": "+919663195195",
    "type": "2",
    "body": "https://maps.app.goo.gl/dKVhTmtfQqtpuH3H9?g_st=a"
  },
  {
    "date": "2025-12-29T12:57:49.762Z",
    "address": "JD-ICICIT-S",
    "type": "1",
    "body": "ICICI Bank Credit Card XX7003 debited for INR 200.00 on 29-Dec-25 for UPI-572915836749-RAMESHKA. To dispute call 18001080/SMS BLOCK 7003 to 9215676766"
  },
  {
    "date": "2025-12-29T12:35:28.091Z",
    "address": "AD-ICICIT-S",
    "type": "1",
    "body": "ICICI Bank Credit Card XX7003 debited for INR 25.00 on 29-Dec-25 for UPI-572921828289-RAJA THI. To dispute call 18001080/SMS BLOCK 7003 to 9215676766"
  },
  {
    "date": "2025-12-29T11:07:59.971Z",
    "address": "JD-RBLCRD-S",
    "type": "1",
    "body": "INR3,363.00 spent at DAIWIK HOTELS on RBL Bank credit card (6089) on 29-12-2025.AVL limit- INR312,550.93. Not you? Call 02262327777 "
  },
  {
    "date": "2025-12-29T09:20:12.005Z",
    "address": "+917349792489",
    "type": "1",
    "body": "Hi! You missed a call from +917349792489.Last call:29-12-2025 14:30:30."
  },
  {
    "date": "2025-12-29T09:00:54.890Z",
    "address": "AA-AIRVMS-S",
    "type": "1",
    "body": "Your voice mailbox is almost full. Please dial 52555 to delete some messages and keep receiving new voice message."
  },
  {
    "date": "2025-12-29T06:54:20.681Z",
    "address": "AX-PSCLTN-S",
    "type": "1",
    "body": "Dear Ashish Tripathi , your ferry ticket No: P-12230664 is confirmed. Fare: Rs 1500.00. Check-in between 14:00 - 14:30 on ( 01-01-2026 ) . Download your ticket here: https://1xpl.co/PSCLTN/0DtPbH - Poompuhar Shipping Corporation"
  },
  {
    "date": "2025-12-29T06:53:47.662Z",
    "address": "JD-PHONPE-S",
    "type": "1",
    "body": "Poompuhar Shipping Corporation Ltd has requested money from you on PhonePe.Rs.1500 will be debited from your account on approving the request - https://phone.pe/PHONPE/bi6siwbi"
  },
  {
    "date": "2025-12-29T06:48:07.822Z",
    "address": "AD-PSCLTN-S",
    "type": "1",
    "body": "240938 is your OTP to login for book the ferry tickets. Ref.Id: HT - Poompuhar Shipping Corporation"
  },
  {
    "date": "2025-12-28T12:52:34.206Z",
    "address": "VM-NSESMS-S",
    "type": "1",
    "body": "ZERODHA BROKING LIMITED on 20-12-25 reported your Fund bal Rs.-185.86 & Securities bal 0. This excludes your Bank, DP & PMS bal with the broker-NSE"
  },
  {
    "date": "2025-12-28T10:50:20.401Z",
    "address": "AX-ICICIT-S",
    "type": "1",
    "body": "ICICI Bank Credit Card XX7003 debited for INR 30.00 on 28-Dec-25 for UPI-572800658530-UMABALAN. To dispute call 18001080/SMS BLOCK 7003 to 9215676766"
  },
  {
    "date": "2025-12-28T07:26:34.054Z",
    "address": "CP-SKYHMS-S",
    "type": "1",
    "body": "Thank you for staying in Hotel The Nook, Room No. Group Hope you enjoyed the stay, Please send your feedback to reservations@hotelthenook.com. Powered by SKYHMS"
  },
  {
    "date": "2025-12-28T07:24:53.382Z",
    "address": "VM-ICICIT-S",
    "type": "1",
    "body": "Rs 7,413.00 spent on ICICI Bank Card XX7003 on 28-Dec-25 at UPI-57282063222. Avl Lmt: Rs 2,15,254.48. To dispute, call 18002662/SMS BLOCK 7003 to 9215676766. To convert this txn to EMI give a missed call on 9924667667. Know more about EMI conversion at https://icici.co/ICICIT/igxDaL"
  },
  {
    "date": "2025-12-28T06:01:45.534Z",
    "address": "+919344563883",
    "type": "1",
    "body": "Hi! You missed a call from +919344563883.Last call:28-12-2025 11:31:37."
  },
  {
    "date": "2025-12-28T06:01:39.303Z",
    "address": "AA-AIRVMS-S",
    "type": "1",
    "body": "Your voice mailbox is almost full. Please dial 52555 to delete some messages and keep receiving new voice message."
  },
  {
    "date": "2025-12-27T16:18:39.287Z",
    "address": "CP-SKYHMS-S",
    "type": "1",
    "body": "Welcome Mr.ASHISH TRIPATHI to Hotel Nook, Room No 104 Have a pleasant stay. Powered By SKYHMS"
  },
  {
    "date": "2025-12-27T16:18:35.383Z",
    "address": "CP-SKYHMS-S",
    "type": "1",
    "body": "Welcome Mr.ASHISH TRIPATHI to Hotel Nook, Room No 101 Have a pleasant stay. Powered By SKYHMS"
  },
  {
    "date": "2025-12-27T10:29:42.313Z",
    "address": "+918071819798",
    "type": "1",
    "body": "Hi! You missed a call from +918071819798.Last call:27-12-2025 15:59:33."
  },
  {
    "date": "2025-12-27T10:29:37.633Z",
    "address": "AA-AIRVMS-S",
    "type": "1",
    "body": "Your voice mailbox is almost full. Please dial 52555 to delete some messages and keep receiving new voice message."
  },
  {
    "date": "2025-12-27T08:17:50.254Z",
    "address": "JM-RBLCRD-S",
    "type": "1",
    "body": "Hi, we have received a payment of INR 5,099.00 towards your   (XXXX89) on Dec 26, 2025. RBL Bank"
  },
  {
    "date": "2025-12-27T06:36:32.977Z",
    "address": "+919450134602",
    "type": "1",
    "body": "Hi! You missed a call from +919450134602.Last call:27-12-2025 12:06:20."
  },
  {
    "date": "2025-12-27T06:36:24.079Z",
    "address": "AA-AIRVMS-S",
    "type": "1",
    "body": "Your voice mailbox is almost full. Please dial 52555 to delete some messages and keep receiving new voice message."
  },
  {
    "date": "2025-12-27T05:43:32.990Z",
    "address": "AD-HDFCBK-S",
    "type": "1",
    "body": "Withdrawn Rs.7500 From HDFC Bank Card x5337 At +EDEN GARDEN On 2025-12-27:11:13:25 Bal Rs.45937.74 Not You? Call 18002586161/SMS BLOCK DC  5337 to 7308080808"
  },
  {
    "date": "2025-12-27T04:21:35.537Z",
    "address": "JK-JIOHTR-S",
    "type": "1",
    "body": "<#> 9695 is your JioHotstar verification code. Enjoy watching! /wAX/OsgZgE"
  },
  {
    "date": "2025-12-27T03:34:10.425Z",
    "address": "AD-AIRTEL-S",
    "type": "1",
    "body": "Hi, a payment of Rs. 352.82 is updated against your Airtel Postpaid 7607433733 . To download your payment receipt or know more about your connection, visit Airtel Thanks App https://www.airtel.in/5/trnxs"
  },
  {
    "date": "2025-12-27T03:34:05.660Z",
    "address": "Airtel-S",
    "type": "1",
    "body": "Thank you! We have received the payment of INR 352.82 on 27-12-2025 09:03 for your Airtel number. Your e-receipt number is 1722075520. The payment will be credited to your Airtel account within 4 hours. Manage your Airtel account On-The-Go with Airtel Thanks App. Download here\\: www.airtel.in/5/app"
  },
  {
    "date": "2025-12-27T00:32:23.824Z",
    "address": "JD-ICICIT-S",
    "type": "1",
    "body": "We have applied Usage Settings on ICICI Bank Credit Card XX7003. Log in to iMobile Pay/Net Banking > View/Manage Card Usage. For details call 1800 1080."
  },
  {
    "date": "2025-12-26T17:50:17.568Z",
    "address": "JD-ICICIT-S",
    "type": "1",
    "body": "USD 10.00 spent using ICICI Bank Card XX7003 on 26-Dec-25 on GITHUB, INC.. Avl Limit: INR 2,23,409.48. If not you, call 1800 2662/SMS BLOCK 7003 to 9215676766."
  },
  {
    "date": "2025-12-26T17:30:12.985Z",
    "address": "JX-ICICIT-S",
    "type": "1",
    "body": "Txn of INR 943.13 is declined, as International Online Txns are disabled on ICICI Bank Credit Card XX2003. Enable at icici.onelink.me/zT47/ccpaMccm"
  },
  {
    "date": "2025-12-26T10:22:07.003Z",
    "address": "+918071755580",
    "type": "1",
    "body": "Hi! You missed a call from +918071755580.Last call:26-12-2025 15:52:00."
  },
  {
    "date": "2025-12-26T10:22:03.878Z",
    "address": "AA-AIRVMS-S",
    "type": "1",
    "body": "Your voice mailbox is almost full. Please dial 52555 to delete some messages and keep receiving new voice message."
  },
  {
    "date": "2025-12-26T09:04:39.471Z",
    "address": "JX-ICICIT-S",
    "type": "1",
    "body": "Rs.50 paid at Orion Uptown Mall for KA53MM4849 on 26-12-2025 14:31:27 with ICICI Bank FASTag. Bal Rs.324. Call 18002100104 for dispute"
  },
  {
    "date": "2025-12-26T08:44:38.532Z",
    "address": "JM-ICICIT-S",
    "type": "1",
    "body": "ICICI Bank Credit Card XX7003 debited for INR 384.62 on 26-Dec-25 for UPI-572617333575-MC DONAL. To dispute call 18001080/SMS BLOCK 7003 to 9215676766"
  },
  {
    "date": "2025-12-26T08:44:28.065Z",
    "address": "JD-MLKBKT-S",
    "type": "1",
    "body": "Dear Customer, your Milkbasket top-up was successful! Your account has been credited with Rs. 2000.0 on 2025-12-26 14:14:23. New Balance: Rs 2176.87. Thank you!"
  },
  {
    "date": "2025-12-26T08:36:38.075Z",
    "address": "JK-PANTLS-S",
    "type": "1",
    "body": "Hello! We love that you found what you were looking for at Pantaloons. Pls take a few seconds & help us know you better, click s.cplry.com/MzIyODkyMjE2KzE ."
  },
  {
    "date": "2025-12-26T08:36:01.923Z",
    "address": "JD-RBLCRD-S",
    "type": "1",
    "body": "INR2,086.20 spent at ADITYA BIRLA FASHION A on RBL Bank credit card (6089) on 26-12-2025.AVL limit- INR315,913.93. Not you? Call 02262327777 "
  },
  {
    "date": "2025-12-26T08:35:26.385Z",
    "address": "AX-PANTLS-S",
    "type": "1",
    "body": "Dear customer thank you for shopping with Pantaloons. Please click the link to view your e-bill https://knvl.me/PANTLS/npd2B7T"
  },
  {
    "date": "2025-12-26T06:55:55.700Z",
    "address": "JK-ZEEOTT-S",
    "type": "1",
    "body": "Your OTP is: 5229.@www.zee5.com 5229 - ZEE5"
  },
  {
    "date": "2025-12-26T04:34:57.750Z",
    "address": "AD-ICICIT-S",
    "type": "1",
    "body": "Payment of Rs 26,787.43 has been received on your ICICI Bank Credit Card XX2003 through Bharat Bill Payment System on 26-DEC-25."
  },
  {
    "date": "2025-12-26T04:34:51.500Z",
    "address": "AX-ICICIT-S",
    "type": "1",
    "body": "Payment of Rs 34,915.61 has been received on your ICICI Bank Credit Card XX7003 through Bharat Bill Payment System on 26-DEC-25."
  },
  {
    "date": "2025-12-26T03:59:09.545Z",
    "address": "JD-RBLBNK-S",
    "type": "1",
    "body": "Payment of Rs.5099.00 received on RBL Bank Credit Card XX89 on 26-12-2025, subject to realisation. Avl Limit Rs.318000.13. View on MyCard app- onelink.to/389ejv"
  },
  {
    "date": "2025-12-26T03:56:53.825Z",
    "address": "JD-ICICIT-S",
    "type": "1",
    "body": "ICICI Bank Credit Card XX7003 debited for INR 50.00 on 26-Dec-25 for UPI-572603275801-Shreeniv. To dispute call 18001080/SMS BLOCK 7003 to 9215676766"
  },
  {
    "date": "2025-12-26T01:06:40.166Z",
    "address": "57575701",
    "type": "1",
    "body": "Epic Games: Your verification code is 269801"
  },
  {
    "date": "2025-12-26T00:55:00.977Z",
    "address": "AX-IDFCFB-S",
    "type": "1",
    "body": "Your A/C XXXXX037696 is credited with INR 25,000.00 on 26/12/25 06:24. Your new balance is INR 1,42,938.65. Team IDFC FIRST Bank"
  },
  {
    "date": "2025-12-26T00:42:21.999Z",
    "address": "AX-ICICIT-S",
    "type": "1",
    "body": "ICICI Bank Credit Card XX7003 debited for INR 258.00 on 26-Dec-25 for UPI-572628261960-Blinkit. To dispute call 18001080/SMS BLOCK 7003 to 9215676766"
  },
  {
    "date": "2025-12-25T14:46:15.369Z",
    "address": "JM-ICICIT-S",
    "type": "1",
    "body": "ICICI Bank Credit Card XX7003 debited for INR 245.00 on 25-Dec-25 for UPI-572513240784-Mr ABDUL. To dispute call 18001080/SMS BLOCK 7003 to 9215676766"
  },
  {
    "date": "2025-12-25T13:50:24.815Z",
    "address": "JD-ICICIT-S",
    "type": "1",
    "body": "ICICI Bank Credit Card XX7003 debited for INR 38.00 on 25-Dec-25 for UPI-572517231143-VENUGOPA. To dispute call 18001080/SMS BLOCK 7003 to 9215676766"
  },
  {
    "date": "2025-12-25T11:10:52.203Z",
    "address": "JX-ICICIT-S",
    "type": "1",
    "body": "ICICI Bank Credit Card XX2003 Statement is sent to tr**************33@yahoo.com. Total of Rs 26,787.43 or minimum of Rs 23,440.00 is due by 05-JAN-26."
  },
  {
    "date": "2025-12-25T07:12:40.296Z",
    "address": "JX-ICICIT-S",
    "type": "1",
    "body": "ICICI Bank Credit Card XX7003 debited for INR 70.00 on 25-Dec-25 for UPI-572504158904-CHAMUNDE. To dispute call 18001080/SMS BLOCK 7003 to 9215676766"
  },
  {
    "date": "2025-12-25T05:11:14.606Z",
    "address": "+919560508669",
    "type": "1",
    "body": "Hi! You missed a call from +919560508669.Last call:25-12-2025 10:41:12."
  },
  {
    "date": "2025-12-25T03:37:59.646Z",
    "address": "JK-SBIUPI-S",
    "type": "1",
    "body": "Dear UPI User, UPI AutoPay for Reliance Retail Limited debit of Rs.2000.00 is scheduled on .26/12/25, 943affe25a1c451b802b9c2cf1ba1b89@ybl. Please ensure sufficient balance in your account. -SBI"
  },
  {
    "date": "2025-12-24T15:56:59.862Z",
    "address": "VM-VAAHAN-G",
    "type": "1",
    "body": "        !     -     ,        -/    ,    ,        ;                      . MoRTH"
  },
  {
    "date": "2025-12-24T15:14:31.068Z",
    "address": "AX-ICICIT-S",
    "type": "1",
    "body": "ICICI Bank Credit Card XX7003 debited for INR 15.00 on 24-Dec-25 for UPI-572407079363-Kolar. To dispute call 18001080/SMS BLOCK 7003 to 9215676766"
  },
  {
    "date": "2025-12-24T15:00:31.188Z",
    "address": "VM-ICICIT-S",
    "type": "1",
    "body": "ICICI Bank Credit Card XX7003 debited for INR 2,619.00 on 24-Dec-25 for UPI-572410087439-Decathlo. To dispute call 18001080/SMS BLOCK 7003 to 9215676766"
  },
  {
    "date": "2025-12-24T15:00:27.162Z",
    "address": "CP-DCTHLN-S",
    "type": "1",
    "body": "Thank you for choosing Decathlon! We're going green, so here's your purchase's E-receipt  (5 quantity) : https://yourbill.me?i=4xnvmumjk54udm"
  },
  {
    "date": "2025-12-24T14:59:33.589Z",
    "address": "JM-DCTHLN-S",
    "type": "1",
    "body": "Dear Customer, Please use OTP code 5968 to redeem your Wallet. The code expires in 5 minutes. Thanks - Decathlon!"
  },
  {
    "date": "2025-12-24T13:10:36.435Z",
    "address": "AE-AIRINF-T",
    "type": "1",
    "body": "<#> 8763 is your OTP to login into Airtel Thanks app. Valid for 100 secs. Do not share with anyone. If this was not you click i.airtel.in/Contact N9BWuqauU1y"
  },
  {
    "date": "2025-12-24T13:10:26.127Z",
    "address": "JX-ICICIT-S",
    "type": "1",
    "body": "ICICI Bank Credit Card XX7003 debited for INR 199.00 on 24-Dec-25 for UPI-136527299509-Airtel. To dispute call 18001080/SMS BLOCK 7003 to 9215676766"
  },
  {
    "date": "2025-12-24T13:10:16.112Z",
    "address": "AE-AIRINF",
    "type": "1",
    "body": "Hi, we have processed Rs. 199.0 for your Airtel Mobile 8792875996. The payment will be updated within 15 minutes. Please keep your order ID 7409581067182657536 for future reference. Track your payment status via  https://i.airtel.in/Recharge-Bills"
  },
  {
    "date": "2025-12-24T08:12:06.673Z",
    "address": "VM-TATALI-S",
    "type": "1",
    "body": "Attention! Premium of Rs. 1748.00 for your Tata AIA Life Insurance Policy C266121914 is due on 23/12/2025. Click https://mtl.ms/TATALI/NQBdo72c to pay through multiple options available online. If the premium remains unpaid, the policy will lapse. The suicide clause and waiting period for health riders (if opted), will be applicable post successful policy revival as per T&C. Ignore if already paid."
  },
  {
    "date": "2025-12-24T07:08:03.545Z",
    "address": "JD-ICICIT-S",
    "type": "1",
    "body": "ICICI Bank Credit Card XX7003 debited for INR 61.95 on 24-Dec-25 for UPI-572426991263-XPANSE. To dispute call 18001080/SMS BLOCK 7003 to 9215676766"
  },
  {
    "date": "2025-12-24T07:05:06.507Z",
    "address": "VM-WEBSUP-S",
    "type": "1",
    "body": "Your mobile verification code is: 508721 ZYsk2qPDRW5"
  },
  {
    "date": "2025-12-24T05:06:18.491Z",
    "address": "JK-APOLAB-S",
    "type": "1",
    "body": "Dear Customer,Kindly note down the verification code  9605 for future reference. Apollo Diagnostics"
  },
  {
    "date": "2025-12-24T03:23:08.055Z",
    "address": "AX-ICICIT-S",
    "type": "1",
    "body": "ICICI Bank Credit Card XX7003 debited for INR 293.00 on 24-Dec-25 for UPI-572425965175-Swiggy. To dispute call 18001080/SMS BLOCK 7003 to 9215676766"
  },
  {
    "date": "2025-12-23T17:06:08.659Z",
    "address": "CP-POLBAZ-S",
    "type": "1",
    "body": "Ashish Tripathi payment of Rs.1748 for your TATA AIA Life policy no. C266121914 has been successfully debited on Dec 23, 2025. Team Policybazaar"
  },
  {
    "date": "2025-12-23T15:29:46.502Z",
    "address": "JD-axioFS-S",
    "type": "1",
    "body": "Thank you for availing Pay Later credit of Rs941.0. For more info click https://u.axio.ac/axo/w2eqgkB9Bx3w To report misuse call 18009877678 -axio"
  },
  {
    "date": "2025-12-23T03:36:06.823Z",
    "address": "AX-ICICIT-S",
    "type": "1",
    "body": "ICICI Bank Credit Card XX7003 debited for INR 50.00 on 23-Dec-25 for UPI-572314810761-Shreeniv. To dispute call 18001080/SMS BLOCK 7003 to 9215676766"
  },
  {
    "date": "2025-12-22T10:32:24.669Z",
    "address": "JD-ICICIT-S",
    "type": "1",
    "body": "ICICI Bank Credit Card XX7003 debited for INR 448.00 on 22-Dec-25 for UPI-572209724425-RELIANCE. To dispute call 18001080/SMS BLOCK 7003 to 9215676766"
  },
  {
    "date": "2025-12-22T06:45:31.881Z",
    "address": "CP-POLBAZ-S",
    "type": "1",
    "body": "Ashish Tripathi payment of Rs.1748 for your TATA AIA Life policy no. C266121914 is due on 2025-12-23. The amount will be debited from your credit card/bank account. Please maintain sufficient balance. Team Policybazaar"
  },
  {
    "date": "2025-12-22T05:56:18.504Z",
    "address": "AD-AIRTEL-S",
    "type": "1",
    "body": "Never respond to emails/embedded links in messages/calls asking you to update or verify KYC documents/User ID/Password/Debit Card Number/PIN/CVV/OTP etc. Immediately change your passwords/CVV/PIN if you have accidentally revealed your credentials."
  },
  {
    "date": "2025-12-21T16:17:22.747Z",
    "address": "CP-axioFS-S",
    "type": "1",
    "body": "Thank you for availing Pay Later credit of Rs555.0. For more info click https://u.axio.ac/axo/aP3sghSOwnVMLRV To report misuse call 18009877678 -axio"
  },
  {
    "date": "2025-12-21T14:35:10.768Z",
    "address": "VM-HPCLIS-S",
    "type": "1",
    "body": "We confirm receipt of online payment made via HPPAY for 855.50 against LPG Refill Booking No: 1250952900208650.Your Delivery Authentication Code is 8050 - HPCL"
  },
  {
    "date": "2025-12-21T14:35:05.917Z",
    "address": "AD-HPPAYS-S",
    "type": "1",
    "body": "Dear Customer, Transaction of Rs. 855.50 for your LPG booking  is successful  bearing LPG Refill Order ID.  1250952900208650  .  Regards, HP PAY Team"
  },
  {
    "date": "2025-12-21T13:17:31.950Z",
    "address": "JD-SWIGGY-S",
    "type": "1",
    "body": "Your Swiggy Instamart replacement order #225292076576600 was delivered. We appreciate your patience. Thank you for ordering from Swiggy Instamart."
  },
  {
    "date": "2025-12-21T13:08:04.843Z",
    "address": "CP-SWIGGY-S",
    "type": "1",
    "body": "We're sorry about your last Swiggy Instamart order! Replacement order #225292076576600 is on its way and should reach you in 5 - 6 minutes. Amount payable: Rs 0."
  },
  {
    "date": "2025-12-21T12:54:06.122Z",
    "address": "VM-ICICIT-S",
    "type": "1",
    "body": "ICICI Bank Credit Card XX7003 debited for INR 449.00 on 21-Dec-25 for UPI-572110600782-Swiggy. To dispute call 18001080/SMS BLOCK 7003 to 9215676766"
  },
  {
    "date": "2025-12-21T09:35:12.397Z",
    "address": "JK-MLKBKT-S",
    "type": "1",
    "body": "Holiday Setup! Dear Customer - You have successfully setup a holiday starting 27 Dec for 6 days. To cancel anytime reach us at hello@milkbasket.com. Safe Travels! Team MB"
  },
  {
    "date": "2025-12-21T09:31:21.058Z",
    "address": "JE-JIOVOC-S",
    "type": "1",
    "body": "Your JioFiber experience matters to us! Share your feedback and help us serve you better: www.jio.com/r/CxxjHtg0h Thank you for choosing JioFiber!"
  },
  {
    "date": "2025-12-21T08:10:28.015Z",
    "address": "JD-ZEEOTT-S",
    "type": "1",
    "body": "Your OTP is: 7154.@www.zee5.com 7154 - ZEE5"
  },
  {
    "date": "2025-12-21T07:53:44.282Z",
    "address": "AX-IndiGo-S",
    "type": "1",
    "body": "Hi Ashish, 286134 is your One Time Password. OTP is valid for 5 minutes. Do not share this OTP with anyone. Regards, IndiGo"
  },
  {
    "date": "2025-12-21T05:30:39.528Z",
    "address": "JX-ICICIT-S",
    "type": "1",
    "body": "ICICI Bank Credit Card XX7003 debited for INR 80.00 on 21-Dec-25 for UPI-572123519245-VIJIYAMM. To dispute call 18001080/SMS BLOCK 7003 to 9215676766"
  },
  {
    "date": "2025-12-21T04:55:53.366Z",
    "address": "VM-ICICIT-S",
    "type": "1",
    "body": "ICICI Bank Credit Card XX7003 debited for INR 209.00 on 21-Dec-25 for UPI-317267237541-GT KADUG. To dispute call 18001080/SMS BLOCK 7003 to 9215676766"
  },
  {
    "date": "2025-12-21T04:22:38.297Z",
    "address": "JD-ICICIT-S",
    "type": "1",
    "body": "ICICI Bank Credit Card XX7003 debited for INR 60.00 on 21-Dec-25 for UPI-608848003550-CAFE MUM. To dispute call 18001080/SMS BLOCK 7003 to 9215676766"
  },
  {
    "date": "2025-12-20T15:27:05.124Z",
    "address": "VM-ICICIT-S",
    "type": "1",
    "body": "ICICI Bank Credit Card XX7003 debited for INR 158.00 on 20-Dec-25 for UPI-572005459814-Kapoors. To dispute call 18001080/SMS BLOCK 7003 to 9215676766"
  },
  {
    "date": "2025-12-20T13:06:56.071Z",
    "address": "CP-POLBAZ-S",
    "type": "1",
    "body": "Ashish Tripathi payment of Rs.1748 for your TATA AIA Life policy no. C266121914 is due on 2025-12-23. The amount will be debited from your credit card/bank account. Please maintain sufficient balance. Team Policybazaar"
  },
  {
    "date": "2025-12-20T10:55:26.167Z",
    "address": "JX-ICICIT-S",
    "type": "1",
    "body": "Rs.150 paid at Phoenix Mall of Asia  for KA53MM4849 on 20-12-2025 16:24:02 with ICICI Bank FASTag. Bal Rs.374. Call 18002100104 for dispute"
  },
  {
    "date": "2025-12-20T10:39:54.541Z",
    "address": "VM-ICICIT-S",
    "type": "1",
    "body": "ICICI Bank Credit Card XX7003 debited for INR 150.00 on 20-Dec-25 for UPI-572023405884-Hamleys. To dispute call 18001080/SMS BLOCK 7003 to 9215676766"
  },
  {
    "date": "2025-12-20T05:22:38.559Z",
    "address": "VM-ICICIT-S",
    "type": "1",
    "body": "ICICI Bank Credit Card XX7003 debited for INR 170.00 on 20-Dec-25 for UPI-572009356558-VINAY. To dispute call 18001080/SMS BLOCK 7003 to 9215676766"
  },
  {
    "date": "2025-12-20T04:51:38.396Z",
    "address": "AX-ICICIT-S",
    "type": "1",
    "body": "ICICI Bank Credit Card XX7003 debited for INR 60.00 on 20-Dec-25 for UPI-572028343377-CHANDRAM. To dispute call 18001080/SMS BLOCK 7003 to 9215676766"
  },
  {
    "date": "2025-12-20T04:42:09.727Z",
    "address": "AX-ICICIT-S",
    "type": "1",
    "body": "ICICI Bank Credit Card XX7003 debited for INR 45.00 on 20-Dec-25 for UPI-284938586141-THE ARUN. To dispute call 18001080/SMS BLOCK 7003 to 9215676766"
  },
  {
    "date": "2025-12-20T04:37:17.503Z",
    "address": "JD-ICICIT-S",
    "type": "1",
    "body": "ICICI Bank Credit Card XX7003 debited for INR 200.00 on 20-Dec-25 for UPI-129377880819-ZAKEER. To dispute call 18001080/SMS BLOCK 7003 to 9215676766"
  },
  {
    "date": "2025-12-19T16:57:42.118Z",
    "address": "AX-Pluxee-S",
    "type": "1",
    "body": "Rs. 212.00 spent from Pluxee  Meal Card wallet, card no.xx9013 on 19-12-2025 22:27:35 at SWIGGY . Avl bal Rs.2168.23. Not you call 18002106919"
  },
  {
    "date": "2025-12-19T13:15:41.627Z",
    "address": "AD-AIRTEL-S",
    "type": "1",
    "body": "You're safer from scams than before. See how many spam calls/SMS were flagged and how many fraud links were blocked for you by Airtel. Check your safety report here: https://i.airtel.in/SafetyReport"
  },
  {
    "date": "2025-12-19T10:34:04.899Z",
    "address": "+916361116880",
    "type": "1",
    "body": "Hi! You missed a call from +916361116880.Last call:19-12-2025 16:03:56."
  },
  {
    "date": "2025-12-19T09:53:14.380Z",
    "address": "+918792875996",
    "type": "1",
    "body": "Hi! You missed a call from +918792875996.Last call:19-12-2025 15:23:06."
  },
  {
    "date": "2025-12-19T09:45:31.371Z",
    "address": "+919450134602",
    "type": "1",
    "body": "Hi! You missed a call from +919450134602.Last call:19-12-2025 15:15:25."
  },
  {
    "date": "2025-12-19T08:23:53.410Z",
    "address": "JM-ICICIT-S",
    "type": "1",
    "body": "ICICI Bank Credit Card XX7003 debited for INR 23.00 on 19-Dec-25 for UPI-571930231496-HungerBo. To dispute call 18001080/SMS BLOCK 7003 to 9215676766"
  },
  {
    "date": "2025-12-19T05:30:46.256Z",
    "address": "VM-SBIUPI-S",
    "type": "1",
    "body": "Dear UPI user A/C X1760 debited by 25000 on date 19Dec25 trf to JAI  PRAKASH Refno 571901234321 If not u? call-1800111109 for other services-18001234-SBI"
  },
  {
    "date": "2025-12-19T01:03:59.403Z",
    "address": "CP-axioFS-S",
    "type": "1",
    "body": "Thank you for availing Pay Later credit of Rs180.0. For more info click https://u.axio.ac/axo/iR2bYUxrtHjrqGr To report misuse call 18009877678 -axio"
  },
  {
    "date": "2025-12-18T08:26:40.816Z",
    "address": "VM-INPOST-S",
    "type": "1",
    "body": "Delivery attempt for SP_INLAND_DOC No: PP580941202IN is Successful on 2025-12-18 13:56:35 - IndiaPost"
  },
  {
    "date": "2025-12-18T08:25:51.042Z",
    "address": "VA-INPOST-S",
    "type": "1",
    "body": "Delivery attempt for SP_INLAND_DOC No: PP580959217IN is Successful on 2025-12-18 13:55:44 - IndiaPost"
  },
  {
    "date": "2025-12-18T06:47:55.731Z",
    "address": "57575022",
    "type": "1",
    "body": "Amazon: Your code is 440112. Don't share it. If you didn't request it, deny here https://amazon.co.uk/a/c/r/VyjXZ0ZJRsy3Qf7sD7XesKn1b"
  },
  {
    "date": "2025-12-18T05:19:06.235Z",
